Title,CompanyDetails,JobDetails,JobDescription,JobSkills
Data Analyst (Weekday Sched) - WFH,"VCC Link, Inc. · Metro Manila 1 week ago · 3 applicants",Full-time Entry level,"About the job
This job is sourced from a job board. Learn More
Help us EMPOWER people's lives. Join us and be a part of our Team!

✔️ CURRENTLY WORK FROM HOME SET UP (MIXED SET UP IN THE FUTURE)

✔️ FIXED WEEKENDS OFF AND DAYSHIFT SCHEDULE

✔️ MONTHLY ACTIVITY BREATHER

✔️ SALARY RANGE 16K-19K (Based on relevant experience)

Responsibilities

 Responsible for gathering data from the company/department's data server and reporting data for the section's internal and external management.
 Aid in the creation and execution of quality assurance system. Analyze and interpret patterns in complex data sets.
 Support the design, development and maintenance of HR analytical tools.
 Produce materials to go with all tools and software solutions and create standard and customized data for other reports.
 Create and execute processes for system testing, diagnosis, and troubleshooting.
 Oversee data analytics, reporting tactics, and the development and improvement of dashboards in system.
 Provide actionable insight and be in charge of developing and optimizing reporting dashboards and evaluating results.
 Work closely with other departments to prioritize business needs and find new ways to improve opportunities.
 Analyze the collected data in comparison to the advantages listed in the contract between the company and the Client.
 Consider and introduce automation to newly created process to eliminate human error.
 Evaluate performance data and establish benchmarks for future tracking.
 Contribute to data capture, storage and forecast analysis projects.

Qualifications

 Bachelor’s degree required, IT or Statistical related course w/ at least 6 months of related experience.
 Advance knowledge in Excel such as but not limited to: Formulas and Functions, PivotTables and PivotCharts, Data Analysis Tools, Macros and VBA (Visual Basic for Applications), Spreadsheet Optimization and Efficiency, Troubleshooting and Error Handling and Data Cleaning and Transformation.
 Proficiency in presenting data visually through charts, graphs, and dashboards to effectively communicate insights and findings.
 Advanced statistical knowledge.
 Advanced proficiency in Microsoft Office applications
 Good verbal and written communication skills.
 Demonstrated success with stakeholder management.
 Highly preferred good working knowledge of Human Resources processes, HRIS applications and ATS
 Able to work independently and perform work efficiently in a fast-paced environment under the pressure of completing deadlines.","Business Insights
Add,Communication
Add,Dashboards
Add,Data Analytics
Add,Electronic Data Capture (EDC)
Add,Graphs
Add,Presentations
Add,Quality Assurance
Add,Stakeholder Management
Add,Written Communication
Add,"
Sr. Data Analyst,"goFLUENT · Quezon City, National Capital Region, Philippines 1 week ago · 1 applicant",On-site Full-time Mid-Senior level,"About the job
goFLUENTs Commitment and Mission

When we talk about hyper-personalized solutions, we truly deliver corporate language training tailored to an organizations unique goals and needs. Since 2000, weve helped millions of people from different industries and locations become better communicators in business languages.

At goFLUENT, every employee works towards the same goal: to make language training accessible, relevant, and effective for every business and learner. Our diverse and multi-talented global teams are always working together to deliver excellent service.

About The Role

Were looking for a Sr. Data Analyst who will be a part of a growing team focused on understanding & analyzing data, creating visualizations & reports, and discovering insights that can help drive business decisions and provide solutions.

In line with our mission, you will have the opportunity to be exposed to a dynamic and international environment by collaborating with different departments across the organization and providing key data that help the business run efficiently.

Responsibilities

Strategy: Interpret data, analyze results using statistical techniques, and provide ongoing reports
Collaboration: Work together with Database and Tech teams and contribute to the shaping of the businesss data infrastructure
Data Management: Extract, Transform, and Load (ETL) data and build data sources based on stakeholders requests
Data Visualization: Acquire data from primary or secondary data sources, and present findings in a clear and concise way by creating dashboards and visualizations


Youll Love This Job if You

Have strong analytical skills with the ability to collect, organize, analyze, and disseminate significant amounts of information with attention to detail and accuracy
Have good English communication skills (verbal and written)
Have a keen attention to detail
Are driven and self-motivated


What Were Looking For

Proven work experience as a data analyst/business data analyst for at least 3 years
Knowledge and experience in Tableau or any BI Visualization tool, and R/Python
Knowledge of statistics, advanced experience using Excel and basic SQL queries
At least a Bachelor's/College Degree in any quantitative field
Willing to work in Eastwood City, Quezon City
Should be a Filipino citizen or hold relevant residence status


What Youll Love In GoFLUENT

Our culture is unlike anywhere else. Starting day one of your , tons of awesome perks and benefits await you, including:

Dynamic, startup-like experience within the security of a fast-growing, 20-year-old Swiss-based company.
Learn from top executives and visionaries in the learning and language market. 
The experience of joining an innovative organization with an international, vibrant working environment.
Full onboarding and fast ramp mentoring program leading candidates to success.
World-class learning experience by being a goFLUENT learner. Learn from one of our twelve business languages!
Exciting global team-building events abroad.


goFLUENT is an equal opportunity employer, so by working with us, youll be part of an organization that supports diversity, equity, and inclusion.

Eager to learn more, watch our video to discover goFLUENT in the words of our people worldwide: https://www.gofluent.com/us-en...

Watch our video to hear it directly from our awesome colleagues https://youtu.be/I6JhScKBWxw&n...;","Data Analysis,Analytics
Add,Communication
Add,Data Analytics
Add,Data Science
Add,Data Visualization
Add,SQL
Add,Statistics
Add,Tagalog
Add,Visualization
Add,"
Data Analyst,"Xurpas Enterprise · Manila, National Capital Region, Philippines 1 month ago · 29 applicants","PHP540,000/yr - PHP1,080,000/yr Hybrid Full-time Entry level","About the job
At Xurpas Enterprise, we are driven by our goal to help organizations of all sizes successfully implement their digital transformation. We offer ready-made business solutions, custom software development, and IT staff outsourcing.

Our consultative, end-to-end process ensures that we provide the best possible solution to address your requirements.

The Role

Your Responsibilities Will Include

Develops, edits, and maintains IT performance measures and reports, as well as studies and internal business reports such as dashboards with key performance indicators for division-level reporting and decision-making.
Additional information: The position is assigned complex, journey-level assignments. The position works with stakeholders and customers to develop, edit, and ensure the ongoing maintenance of performance measures and reports such as maintaining the performance management repository, documenting method of calculation, method of collection, data source, etc.
Reviews and evaluates performance measures, data sources, methods of calculation, and methods of collection and makes recommendations for improvement to business practices.
Additional information: The position reviews the performance management repository and all of the performance measures of the team including documented methods of calculation, methods of collection, and data sources, and makes recommendations for improving the quality and accuracy of performance measures and reports, as well as the functions they measure or report on.
Researches, develops, and recommends measures to assess business problems and practices.
Additional information: Research, develop, and analyze ad hoc or other measures necessary to assess nonroutine business problems that require more understanding by executive leadership to resolve. This may include working with the Management to develop necessary reporting tools to complete the assignment and provide the needed information.
Communicates with stakeholders to ensure participation in the development of internal measures and performance reports.
Additional information: The position will be responsible for ensuring data is accurate and meets the needs of the team, this includes communicating with the group to ensure business requirements are gathered, as well as
coordinating with data owners to ensure the data is reputable and is an accurate reflection of the intended measure.
Informs management of results and recommendations from IT division performance reports and studies.
Additional information: Presents as necessary on research and data analysis results, routine reports, and ad hoc assignments. Audience may include IT management.
Ensures measures meet or exceed industry standards.
Additional information: The position may attend conferences, meet with counterparts at other agencies, research online, and follow emerging trends to ensure the performance measures and reporting tools are efficient, effective, and contemporary, meeting current industry standards.

Ideal Profile

Extensive experience with various Microsoft workstation Technologies (installation, administration, patching, tuning) particularly Microsoft Windows XP Professional, Windows 7, and Windows 10 Operating Systems
Knowledge of Unicenter Software Delivery (alias ITCM) or SSCM (or similar) and Asset Management experience preferred
Knowledge performance analysis.
Considerable knowledge of data analysis.
Programming/scripting experience required:

>Perl

>Powershell

>Power BI/SAP BI and other Business intelligence tools

>Login Group Policies scripting for AD

>VBScript

>VB.net

>ASP

>Advanced skill in MS Excel

>ActiveX Data Objects and basic ANSI SQL knowledge

>ADSI & WMI

>DOS batch scripting

>JavaScript

Creating unattended installations using MSI and InstallShield & customizing User State Migration Tool
Knowledgeable with Active Directory (with emphasis on Group Policies)
Knowledgeable with SQL Server preferred (installation and administration level)
Project management experience a plus
Amenable to work 3x a week onsite in Alabang, Muntinlupa

What's on Offer?

laptop to be provided (pickup from Makati Office)
Upon regularization 30 paid leaves per year
Upon regularization HMO for you PLUS 1 dependent worth P150,000","Data Analysis,ANSI
Add,ActiveX
Add,ActiveX Data Objects (ADO)
Add,Dashboards
Add,Data Analytics
Add,Data Visualization
Add,Key Performance Indicators
Add,SQL
Add,XP Professional
Add,"
Data Analyst,Expro · Metro Manila 2 months ago · 21 applicants,On-site Full-time Entry level,"About the job
Who is Expro?

Working for our clients across the entire well life cycle, Expro is a visionary full-cycle energy services expert offering novel, insightful solutions, dependable competency and award-winning safety.

Combining innovative, future-facing technology with high-quality data across well construction, well flow management and production, subsea well access, and well integrity and intervention, we have a reputation for extraordinary performance that keeps our clients operations running smoothly.

Expro Group are currently recruiting for a Data Analyst to join the Well Intervention team based in Manila .

Overall Purpose of the Job

To provide Cased Hole data analysis and interpretation expertise to operations for internal and external clients. To enhance the reputation and extend the capability of Expro Cased Hole Services through the delivery of high quality analysis and support to both internal and external clients for operations and Business Development.

Key Activities And Accountabilities

Log Analysis

Job Planning
Liaise with clients and operational departments to determine survey objectives and offer advice on how to achieve
Ensure all relevant information required for analysis is identified and requested to be made available Job execution
Ensure that data received is suitable for processing/modelling
Process data to give a true representation of downhole conditions
Write data processing, modelling and interpretation reports as per client requirements After job
Discuss reports with operations team, including field engineer involved in the data gathering process
Check that reports are delivered to client and clients are satisfied with the service provided
Liaise with clients & operations team to discuss and present analysis summary/report
Ensure data is archived as per QA procedures and all paperwork is complete

Operations Support

Maintain & developed relationships with clients & operations team
Instruct field engineers & operation team on data gathering techniques and methods used to quality check recorded data
Assist with operation teams for client visits and data/analysis presentations when required
Perform in accordance with the Expro HSEQC policies and procedures at all times, and reviewing the safety implications of any recommendations arising

SafeWells Support 

Maintain & developed relationships with clients & SafeWells team 
To provide support to new and existing clients of Expro’s SafeWells software.(install, configuration, population, support and training)
To support SafeWells customers and the software development team in providing high quality software and customer services in accordance with our quality management system. 

Business Development Support 

Maintain & developed relationships with clients & BD team
Support BD team for client visits, presentations & ITT preparation when required

Job Knowledge And Qualifications

Engineering or Scientific graduate in Petroleum Engineering, Well Technology or a related discipline or relevant industry experience.

Analytical & interpretative skills / expertise in:

Production Logging
Well integrity
Pressure transients
Well intervention design, planning and operations
run simulation

Why Expro?

People are the most important. And every Expro person engineers our future. They are the drivers of our methodologies. Expro people are confident. They can draw out the right answer which attract the right clients.

At Expro, we live by our values, People, Performance, Planet and Partnerships. People are always at the heart of our success. Performance is getting it right first time, every time. We're committed to reducing our environmental impact and we build relationships with our customers to understand their needs.

The only way to apply for a job at Expro is on our website. For more information around safe recruitment and how we recruit please visit our website at https://www.expro.com/careers/how-we-recruit/safe-recruitment

To apply for this opportunity please click on the 'Apply' button.

Find us at the following","Analytical Skills
Add,Client Requirements
Add,Client Visits
Add,Data Analytics
Add,Data Collection
Add,Data Processing
Add,Data Science
Add,Job Planning
Add,Log Analysis
Add,Presentations
Add,"
Business Intelligence Analyst,"WebBeds · Manila, National Capital Region, Philippines 2 months ago · 26 applicants",Hybrid,"About the job
Who are WebBeds?

WebBeds is the fastest growing and most significant accommodation supplier to the travel industry. We are a global company offering ground services (hotels, transfers, tours, activities) to travel professionals. Our products help our partners and customers to create amazing Travel experiences.

Our Products range from a Retail Online platform, Integration Connectivity hub and distribution APIs to name but a few and our systems are 100% cloud hosted processing up to 5.0bn search requests daily. We deliver amazing outcomes using leading edge technology through innovative and creative thinking.

WebBeds is a subsidiary of Webjet Limited (ASX: WEB) – an ASX 200 listed company operating a global digital travel business.

What makes us stand out?

We are a wholesale global travel organisation
We have 1500+ people speaking 50+ languages in 120+ cites across 50+ countries 
We partner with over 430,000 properties in more than 15,000 destinations 
We work with more than 44,000 travel companies in 139 source markets 
We have an amazing Technology team focused on delivering valuable outcomes using innovative tech and creative & lateral thinking

Job Purpose

The Business Intelligence Analyst at WebBeds plays a critical role in driving data-driven decision-making and providing actionable insights to support business strategy and operations. The purpose of this role is to gather, analyze, and interpret complex data sets to identify trends, patterns, and opportunities that will enable informed business decisions.

The Business Intelligence Analyst will collaborate with cross-functional teams, apply advanced analytical techniques, and leverage business intelligence tools to deliver meaningful reports, dashboards, and recommendations. By effectively translating data into actionable insights, the Business Intelligence Analyst contributes to the overall success and growth of the organization.

Key Responsibilities

Provide stakeholders essential reports as needed for business decisions.
Gather, safekeep, and archive necessary data.
Mine data from database by writing and testing SQL scripts to produce data output as needed.
Develop and implement strategies that optimize statistical efficiency and quality.
Create, introduce, and maintain high-level to entry-level performance reports/dashboards.
Perform in-depth analysis from transactional sources and share insights to stakeholders.
Analyze results and share output to the stakeholders.
Provide support to stakeholders and monitor all requirements for various value-added service.
Administer CRM tool and telephony system by managing automation rules, users, groups/queue, etc. 
Attend to service desk tickets.

Key Measures

Data Accuracy: Ensure that data analysis and reporting are conducted with a high level of accuracy, minimizing errors or inconsistencies in data sets.
Data Insights: Generate meaningful and actionable insights from data analysis, providing valuable information that contributes to informed decision-making.
Timeliness of Reporting: Deliver reports, dashboards, and data-driven recommendations within agreed-upon timelines, meeting the needs and expectations of stakeholders.
Stakeholder Satisfaction: Receive positive feedback from stakeholders regarding the usefulness, relevance, and clarity of the insights and reports provided.
Data Visualization: Create visually appealing and informative data visualizations that effectively communicate complex information to stakeholders.
Technical Proficiency: Demonstrate proficiency in utilizing business intelligence tools, data analysis techniques, and programming languages to effectively analyze and visualize data.
Problem-Solving Skills: Proactively identify and solve complex business problems using data-driven approaches and analytical thinking.
Collaboration: Collaborate effectively with cross-functional teams, such as IT, Customer Service, and Transformation teams as well as business stakeholders, to gather requirements, understand business needs, and deliver insights.
Continuous Learning and Development: Show commitment to staying updated with industry trends, advancements in business intelligence tools and techniques, and actively seek opportunities to improve skills and knowledge through professional development activities.
Adherence to any departmental or individual KPI’s and objectives.

Job Qualifications

Good understanding on database structure concepts.
Advanced knowledge of SQL.
Advanced knowledge of PowerBI. 
Advanced knowledge of MS Excel. 
 Advanced knowledge of MS PowerPoint. 
Proven experience as a Business Intelligence Analyst or similar role, with a strong grasp of data analysis and business intelligence concepts.
Excellent problem-solving skills and attention to detail.
Ability to communicate complex data and insights effectively to both technical and non-technical stakeholders.
Strong collaboration and interpersonal skills to work effectively with cross-functional teams.

Why choose us as your next destination?

We are super proud of our dedicated team of friendly, energetic & passionate professionals. Our people are key to the success of our business & everybody at WebBeds has their own unique role to play as we continue to drive the company forward.

Over 50 different languages are spoken by our workforce, but whether working from offices in Dubai or London or out in the field in Johannesburg or Buenos Aires, we all share the common goal to take pride in what we do & to deliver our partners with unbeatable service & support.

International highly skilled group of experts from all around the globe 🌎
Dynamic environment with the chance to grow, influence & impact change ⚡
Disruptive, fast-growing market leader within travel & endless possibilities 💼
Culture built on collaboration🤝 empowerment and innovation 💡

Find out more about the WebBeds business at www.webbeds.com -","Data Analysis,Analytics
Add,Business Intelligence (BI)
Add,Business Intelligence Tools
Add,Communication
Add,Data Analytics
Add,Data Visualization
Add,Key Performance Indicators
Add,Problem Solving
Add,Technical Proficiency
Add,"
