Title,CompanyDetails,JobDetails,JobDescription,JobSkills
"Data Engineer, Software Development-PHL","Ingram Micro · Taguig, National Capital Region, Philippines Reposted 1 week ago · 38 applicants",On-site Full-time Entry level,"About the job
It's fun to work in a company where people truly BELIEVE in what they're doing!

Job Description:

Ingram Micro touches 80% of the technology you use every day with our focus on Technology Solutions, Cloud, and Commerce and Lifecycle Solutions. With $46 billion in revenue, we have become the world’s largest technology distributor with operations in 56 countries and more than 30,000 associates. We continue to strategically expand our global reach with 32 acquisitions since 2012.

Position Summary

Designs, develops, tests, debugs and implements operating systems components, software tools, and utilities. Determines systems software design requirements. Ensures that system improvements are successfully implemented and monitored to increase efficiency. Generates systems software engineering policies, standards and procedures.

What You Bring To The Role

Established and productive professional individual contributor. 
Works independently with general supervision. 
Problems faced are difficult and may be complex. 
May influence others within the job area through explanation of facts, policies and practices. 
Works on moderate to complex projects. 
Uses company standard policies and procedures to resolve a variety of issues. 
Exercises judgment within defined procedures and practices to determine appropriate action. 
Receives moderate level of guidance. 
Work is reviewed for soundness of judgment and overall accuracy. 
General proficiency with various tools, systems, and procedures required to accomplish the job. 
May need to consult with Senior/Specialist staff members on some technical issues. 
A four year college degree (or additional experience in a related field) and 3 years functional experience including a minimum 1 year position specific experience. 
Monitors all Data Management supported application jobs, such as but not limited to – Magellan, LDB, GDW, HR data, HPCM, and other downstream data marts. 
Assists on issues on SAP Business Objects and CFS reports (QlikSense)
Creates solution to address business/system incident and request tickets in IM-Serve within the required SLA. 
Creates and manages CHG request tickets associated to build and development in IM-Serve. 
Creates and manages job scheduling requests and coordinates with Midrange Scheduling team. 
Creates and/or enhance applications code with consideration for efficiency and ease of maintenance. 
Can identify the technical implication of any solution on the other modules/functionalities. 
Resolves technical issues and analyzes or develops solutions for application programs outside primary application knowledge. 
Escalates issues or gaps in the design
Can coordinate with the other teams that are needed for the requirement/tickets. 
Can investigate and determine the root cause of the issue. 

Requirements

Strong SQL skills, familiar with stored procedures. 
Familiar with scheduling tool such as Control-M. 
Familiar with ticketing tool such as ServiceNow. 
Knowledgeable on Unix/Linux OS basic commands. 
Strong analytical and programming skills, preferably Python. 
Has at least 1 year data warehousing and ETL/ELT (Extract, Transform, Load) / (Extract, Load, Transform). 
AWS Resources exposure and skill is a plus – S3, EC2, Redshift, Lambda. 
GCP exposure and skill is a plus (e.g. BigQuery). 
Knowledgeable on reporting tool – SAP Business Objects and PowerBI, preferably. 

This is not a complete listing of the job duties. It’s a representation of the things you will be doing, and you may not perform all of these duties.","Data Warehousing
Add,Extract, Transform, Load (ETL)
Add,IM
Add,Linux
Add,Qlik Sense
Add,Root Cause
Add,SAP BusinessObjects
Add,Service-Level Agreements (SLA)
Add,Stored Procedures
Add,Unix
Add,"
Machine Learning Engineer,Staffing Ninja · Philippines 1 week ago · 17 applicants,Remote Full-time Mid-Senior level,"About the job
Job description:

We are seeking an experienced and dedicated Machine Learning Engineer with 5+ years of expertise. The successful candidate will play a key role in designing and implementing cutting-edge AI/ML models and solutions using Google Cloud Platform technologies, including Vertex AI, TensorFlow, PyTorch, and Cloud TPUs.

Key Responsibilities:
Design and implement models for content creation, design automation, Cloud Vision AI, and Natural Language AI.
Utilize Google Cloud Platform technologies such as Vertex AI, TensorFlow, PyTorch, and Cloud TPUs.
Develop a deep understanding of generative AI models, including Text-to-Speech applications.
Collaboration and Code Quality:
Collaborate with cross-functional teams to define requirements and brainstorm solutions.
Write and maintain high-quality Python code.
Stay up-to-date on the latest advancements in AI/ML research.
Contribute to internal tools and infrastructure for AI/ML development.
Apply supervised/unsupervised learning, Video analytics, Image analytics, NLP, and advanced analytics techniques.
Conduct exploratory data analysis and implement descriptive, prescriptive, and predictive analytics.
Demonstrate understanding and implementation of MLOps.
Utilize GCP Data Engineering tools (BigQuery, Dataflow, Cloud Data Fusion, etc.).

Requirements:
Bachelor’s or master’s degree in computer science, Data Science, or related field (Ph.D. advantageous).
5+ years of experience in Large Language Models, Time Series Forecasting, NLP, Recommender Systems, Anomaly Detection, Data Mining, SQL, UI/UX Development, and Cloud Computing.
Proficiency in Python and ML libraries (TensorFlow, PyTorch, Keras).
Previous healthcare sector experience with knowledge of regulatory compliance.
Strong data analysis and visualization skills.
Excellent communication and teamwork skills.

Good to have:
GCP Data Engineering understanding (BigQuery, Dataflow, Cloud Data Fusion, etc.).","Data Analysis,Anomaly Detection
Add,Data Science
Add,Exploratory Data Analysis
Add,Keras
Add,Machine Learning
Add,PyTorch
Add,Python (Programming Language)
Add,Recommender Systems
Add,TensorFlow
Add,"
GDS Consulting_Senior Data Engineer 4,"EY · Taguig, National Capital Region, Philippines Reposted 1 week ago · 11 applicants",On-site Full-time Mid-Senior level,"About the job
At EY, you’ll have the chance to build a career as unique as you are, with the global scale, support, inclusive culture and technology to become the best version of you. And we’re counting on your unique voice and perspective to help EY become even better, too. Join us and build an exceptional experience for yourself, and a better working world for all.

 5 to 10 years of Experience in developing data ingestion, data processing and analytical pipelines for big data, relational databases, NoSQL and data warehouse solutions
 Extensive hands-on experience implementing data migration and data processing using Azure services: ADLS, Azure Data Factory, Azure Functions, Synapse/DW, Azure SQL DB, Databricks Azure Data Catalog, Cosmo Db etc.
 Hands on experience in programming like python, scala
 Must have hands on experience in SQL and procedural SQL languages
 Experience working with NoSQL in at least one of the data stores - HBase, Cassandra, MongoDB
 Strong analytical skills and enjoys solving complex technical problems
 Proficiency in Software Development Best Practices
 Strong analytical skills and enjoys solving complex technical problems
 Excellent debugging and optimization skills
 Experience in Enterprise grade solution implementations & in converting business problems/challenges to technical solutions considering security, performance, scalability etc
 Designing and implementing data ingestion pipelines from multiple sources using Azure or AWS Databricks.
 Developing scalable and re-usable frameworks for ingesting of data sets.
 Integrating the end to end data pipeline - to take data from source systems to target data repositories ensuring the quality and consistency of data is maintained at all times.
 Participating in development of cloud data warehouses, data as a service, business intelligence solutions.
 Data wrangling of heterogeneous data.

EY | Building a better working world

EY exists to build a better working world, helping to create long-term value for clients, people and society and build trust in the capital markets.

Enabled by data and technology, diverse EY teams in over 150 countries provide trust through assurance and help clients grow, transform and operate.

Working across assurance, consulting, law, strategy, tax and transactions, EY teams ask better questions to find new answers for the complex issues facing our world today.","Big Data
Add,Cassandra
Add,Data Ingestion
Add,Data Warehousing
Add,HBase
Add,MongoDB
Add,NoSQL
Add,Relational Databases
Add,SQL
Add,Scala
Add,"
Data Engineer-Big Data,"IBM · Quezon City, National Capital Region, Philippines 5 days ago · 5 applicants",On-site Full-time,"About the job
679379BR

Introduction

At IBM, work is more than a job - it's a calling: To build. To design. To code. To consult. To think along with clients and sell. To make markets. To invent. To collaborate. Not just to do something better, but to attempt things you've never thought possible. Are you ready to lead in this new era of technology and solve some of the world's most challenging problems? If so, lets talk.

Your Role and Responsibilities

Develops applications on Big Data and Cognitive technologies including API development. Expected to have traditional Application Development background along with knowledge of Analytics libraries, open-source Natural Language Processing, statistical and big data computing libraries. Strong technical abilities to understand, design, write and debug complex code. Skills include Python, Spark, Kafka, IBM BigInsights, Hadoop, NoSQL, HBase, HIVE, PIG, C++, SQL, Linux, Java, EAI, SOA, CEP, HDFS, ETL

PH_DIGhotjobs

Required Technical and Professional Expertise


Development experience in Big Data software development technologies such as Python, Hadoop, Hive or Spark.
Proficient background in Unix or Linux programming language.
Good understanding in SQL and RDBMS. Good at modeling data for relational, analytical and big data workload.
Provide support for deployed data applications and other data consumers by identifying data problems and guiding issue resolution with partner Data Engineers and source data providers


Preferred Technical And Professional Expertise


Must Have skill in Big Data tools such as Python, Hadoop, Hive or Spark
Proven background in SQL, Unix/Linux and ETL process


About Business Unit

IBM Services is a team of business, strategy and technology consultants that design, build, and run foundational systems and services that is the backbone of the world's economy. IBM Services partners with the world's leading companies in over 170 countries to build smarter businesses by reimagining and reinventing through technology, with its outcome-focused methodologies, industry-leading portfolio and world class research and operations expertise leading to results-driven innovation and enduring excellence.

Your Life @ IBM

In a world where technology never stands still, we understand that, dedication to our clients success, innovation that matters, and trust and personal responsibility in all our relationships, lives in what we do as IBMers as we strive to be the catalyst that makes the world work better.

Being an IBMer means you’ll be able to learn and develop yourself and your career, you’ll be encouraged to be courageous and experiment everyday, all whilst having continuous trust and support in an environment where everyone can thrive whatever their personal or professional background.

Our IBMers are growth minded, always staying curious, open to feedback and learning new information and skills to constantly transform themselves and our company. They are trusted to provide on-going feedback to help other IBMers grow, as well as collaborate with colleagues keeping in mind a team focused approach to include different perspectives to drive exceptional outcomes for our customers. The courage our IBMers have to make critical decisions everyday is essential to IBM becoming the catalyst for progress, always embracing challenges with resources they have to hand, a can-do attitude and always striving for an outcome focused approach within everything that they do.

Are you ready to be an IBMer?

About IBM

IBM’s greatest invention is the IBMer. We believe that through the application of intelligence, reason and science, we can improve business, society and the human condition, bringing the power of an open hybrid cloud and AI strategy to life for our clients and partners around the world.Restlessly reinventing since 1911, we are not only one of the largest corporate organizations in the world, we’re also one of the biggest technology and consulting employers, with many of the Fortune 50 companies relying on the IBM Cloud to run their business. At IBM, we pride ourselves on being an early adopter of artificial intelligence, quantum computing and blockchain. Now it’s time for you to join us on our journey to being a responsible technology innovator and a force for good in the world.

Location Statement

For additional information about location requirements, please discuss with the recruiter following submission of your application.

Being You @ IBM

IBM is committed to creating a diverse environment and is proud to be an equal-opportunity employer. All qualified applicants will receive consideration for employment without regard to race, color, religion, sex, gender, gender identity or expression, sexual orientation, national origin, caste, genetics, pregnancy, disability, neurodivergence, age, veteran status, or other characteristics. IBM is also committed to compliance with all fair employment practices regarding citizenship and immigration status.","API Development
Add,Apache Kafka
Add,Apache Spark
Add,EAI
Add,Extract, Transform, Load (ETL)
Add,HBase
Add,Hadoop
Add,Hive
Add,NoSQL
Add,RDBMS
Add,"
Senior Data Engineer,"RingCentral · Manila, National Capital Region, Philippines Reposted 2 months ago · 5 applicants",On-site Full-time Mid-Senior level,"About the job
Say hello to possibilities at Acquire Asia Pacific Philippines Inc. (Acquire BPO) under the RingCentral account (RingCentral).

It’s not everyday that you consider starting a new career. We’re Acquire BPO, and we’re happy that someone as talented as you is considering this role. First, a little about our client, RingCentral is a $2 billion global leader in cloud-based communications and collaboration software. RingCentral is fundamentally changing the nature of human interaction—giving people the freedom to connect powerfully and personally from anywhere, at any time, on any device.

To succeed in this role you must have experience in:

Data Engineering and Reports Automation:


Building, developing and maintaining internal data cubes/schema (relational and non-relational database), data architecture, reporting systems and data automation for Marketing. 
Ensures effective ETL processes for large datasets and oversees the back-end design and delivery of analytical reports and insights. 
Assist in data discovery, data mapping and data testing within Hadoop and different source systems. 
Manage and optimize processes for data intake, validation, mining and engineering as well as modeling, visualization and communication deliverables. 
Collaborates with the Senior Analytics Manager, Marketing Director and Business Services to optimize an efficient Marketing Databases. 


UAT and Business Analysis:


Collaborate with different departments to understand different source systems (e.g. Salesforce, BI, Marketo, Adobe Analytics) and optimize joint development efforts in data enriching Hadoop’s Database. 
Iteratively test, refine and improve the marketing’s Hadoop data schema/table and Tableau reports. 
Performs business analysis for specified tasks and data sets 
Work closely with other data and analytics team members and IT and Business Service team to optimize the company’s data systems and pipeline architecture and achieve greater efficiency across all of our company data systems. 


Desired Qualifications:


Strong SQL skills (MySQL, Hive, Impala etc.), ability to perform effective querying involving multiple tables and subqueries within multiple data systems. 
Experience in designing and creating relational and non-relational databases Data Warehouse Architecture and ETL scripts. 
knowledge of data mining principles: collecting data from multiple data systems, data governance, data quality and mapping and predictive analytics 
Demonstrated ability to build processes that support data transformation, data structures, metadata, dependency and workload management. 
Able to understand various data structures and common methods in data transformation 
A Date Engineer who has a good attitude and is willing to expand his/her knowledge to Data Science/Analytics 
With at least 3 years of experience in a Data Engineering position 


Proficient and experienced with the following tools/programs: 


Strong programming skills with querying languages: SQL, Linux/Unix etc. 
Experience with big data tools: Teradata, Hadoop, Alteryx etc. 


What we offer:


Comprehensive HMO package (medical and dental)
Personal Time Off Leaves
Quarterly Performance Bonus
Employee Assistance and Wellness Programs


RingCentral’s Global Ops team works collaboratively to provide cohesive support and strategy that build, nurture and lead all aspects of the business. RingCentral has become the leading global cloud-based communications provider because it is not just selling solutions; it is changing the nature of communications.

RingCentral’s work culture is the backbone of our success. And don’t just take our word for it: we are recognized as a Best Place to Work by Glassdoor, the Top Work Culture by Comparably and hold local BPTW awards in every major location. Bottom line: RingCentral is committed to hiring and retaining great people because you power our success. RingCentral offers on-site, remote and hybrid work options optimized for the ways we work and live now.

About RingCentral/Acquire BPO

RingCentral, Inc. is a US-based company engaged as a global provider of cloud unified communications and collaboration solutions. It is being serviced in the Philippines by its offshore partner Acquire Asia Pacific Philippines, Inc.

Acquire BPO is an award-winning, global business outsourcer with 8,500+ staff operating out of Class A offices in 16 locations across the Philippines, Australia, the Dominican Republic, and the US, as well as from comprehensive Work-from-Home environments, where client-permitted. We are one of the fastest-growing BPO companies and Australia’s largest outsourcer to the Philippines.

We have 15 years of experience delivering intelligent contact center and back-office functions for global businesses across many industries including telecommunications, banking and financial services, insurance, media, education, and retail. We're recognized as being Safe, Flexible, and Innovative, giving our clients the capability to Outsource with confidence.

As a dynamic organization with the ability to take your career to the next level, we're looking for strong candidates to join our team and partner with one of the biggest cloud communications companies in the world - RingCentral. We value our employees highly and, as such, offer excellent career development programs and competitive compensation and benefits packages.

Acquire BPO is an equal opportunity employer that truly values diversity. We do not discriminate on the basis of race, religion, color, national origin, gender, sexual orientation, age, marital status, veteran status, or disability status.

By completing your application for this role, you:


Agreed that the information collected through this site will only be processed with your prior consent and for the purpose of facilitating your employment opportunities
Have read and agreed to our Data Privacy Policy


RingCentral, Inc. is a US-based company engaged as a global provider of cloud unified communications and collaboration solutions. It is being serviced in the Philippines by its off-shore partner Acquire Asia Pacific Philippines, Inc. 

# LI-MC1","Data Analytics
Add,Data Cubes
Add,Data Engineering
Add,Data Science
Add,Data Warehouse Architecture
Add,Data Warehousing
Add,Databases
Add,Datasets
Add,Extract, Transform, Load (ETL)
Add,OLAP Cubes
Add,"
Cloud Engineer,"Globe Group · Taguig, National Capital Region, Philippines Reposted 2 weeks ago · 220 applicants",Hybrid Full-time Entry level,"About the job
At Globe, our goal is to create a wonderful world for our people, business, and nation. By uniting people of passion who believe they can make a difference, we are confident that we can achieve this goal.

Job Description

To maintain and operate Cloud infrastructure including upgrades and security patches. Assist in the identification, development and maintenance of policies and procedures that are relevant to the proper operational functions of the Cloud infrastructure. Provide assistance in cloud related projects during all stages, including: assessment, planning, designing, initiation. Maintain operational readiness ensuring complete recovery in the event of a disaster. Attend DR tests regularly, as outlined in the company policies and procedures to ensure DR functionality. Update policies and procedures as required. Evaluation of new versions, patches, firmwares and security patches. Implementing upgrades and security patches regularly. Periodic monitoring of cloud platforms, performance tuning and capacity planning and trend analysis.

Duties & Responsibilities

Must respond promptly to issues reported by clients, conducting root cause analysis and going through various testing scenarios for thorough resolution within the agreed SLA.
Performs public cloud support preferably AWS and GCP by resolving escalated incident from the customer
Provide L2 and L3 support
Compliance review – scheduled compliance tasks performed monthly, quarterly and yearly
Escalation and Troubleshooting – resolution of moderate to complex issues, escalation to public cloud vendor
Maintain, manage and provide troubleshooting procedures to various AWS/GCP issues and escalations
Provide support on other infra-related SR activities.
Provide technical expertise, knowledge, and guidance to other Cloud Engineer
Coordinates with vendors and suppliers when it comes to server and cloud support, if needed
Provide extended assistance to issues related to server and cloud, if needed.
Knowledge transfer to L2/L3 ITS team
Assist vendors in troubleshooting, if needed.
Regular implementation standard review with ITS sysad/cloud team
Regular peer review of infra design, if needed.
Regular peer review with L2/L3 ITS, if needed.
Technical and Process planning with O&M team
Operational requirement standard review
Attend Operational reporting review
Attend team meetings, huddles, scrum meetings, trainings, and KT sessions
Problems encountered are issues with production infra and service request implementations.

Requirements

 At least 1 year work experience in the related field is required for this position
 At least 1 year experience working in system administration / cloud administration, preferably Amazon Web Services and Google Cloud Platform and other cloud providers
 Solid understanding of test methodologies, test design and test best practices to manage service performance KPIs and root cause analysis
 Strong analytical, problem solving and systems thinking abilities
 Knowledgeable in ITSM capabilities: ServiceNow reports, developing dashboards and helping users understand data and patterns
 Familiarity with different infra technology:
Cloud Technology (AWS, GCP)
Virtualization (VMware)
Openstack
DevOps, Automation, Open-source
Assess and troubleshoot infrastructure issues
Discuss technical recommendations and solutions with end-users and stakeholders
 Significant test automation skills around designing, building and maintaining test frameworks
 Good experience in defining test scenarios from requirements and acceptance criteria
 Good in time management, communication and collaboration
 Good in problem solving and handling pressure.
 Familiarity and knowledge with agile delivery methodologies

Nice To Have Certification (in Any Of The Following)

AWS Practitioner
AWS SysOps Administrator Associate
AWS Solutions Architect Associate
GCP Associate Cloud Engineer
GCP Professional Cloud Architect
VMWare Certified Professional - DCV
Certified OpenStack Administrator

Make Your Passion Part of Your Profession. Attracting the best and brightest Talents is pivotal to our success. If you are ready to share our purpose of Creating a Globe of Good, explore opportunities with us.","Communication
Add,Problem Solving
Add,Scenario Testing
Add,Test Design
Add,"
