Title,CompanyDetails,JobDetails,JobDescription,JobSkills
"Senior Mobile Developer, gt.school (Remote) - $100,000/year USD","Crossover  · National Capital Region, Philippines Reposted 6 days ago · 9 applicants",Remote Full-time Mid-Senior level,"About the job
Crossover is the world's #1 source of full-time remote jobs. Our clients offer top-tier pay for top-tier talent. We're recruiting this role for our client, gt.school. Have you got what it takes?

Are you passionate about creating high-quality applications that truly matter? We’re looking for someone who values clean, modular code, aligns with our emphasis on high-quality work, and is eager to take ownership of a product that is pivotal to our vision. If shaping the next generation of grade school education sounds exciting, this opportunity might be perfect for you.

At gt. school, our focus isn’t just on creating another app; we're pioneering an innovative approach to learning by integrating modern techniques like advanced AI, adaptive computer-based training, gamification, and continuous feedback. At the heart of it all, our app draws inspiration from popular platforms like TikTok, allowing learners to have an immersive feed experience, making education interactive, engaging, and truly enjoyable.

This role demands ownership and independence; we believe that restricting oneself to front-end or back-end is counterproductive. Here, we advocate for full-spectrum development. If a tweak in the API or a backend validation is needed, we trust you'll handle it. Your decisions will significantly shape the product and ensure a seamless and intuitive experience for our users.

Your responsibilities will include transforming UI designs into functional app features, investigating and fixing bugs, and collaborating with our product and backend teams to ensure consistent functionality. While the fast-paced environment is challenging, the reward in terms of both personal growth and the tangible impact on students is immense.

If this resonates with you, and you're up for the challenge of making a significant difference in the EdTech space, we would love to hear from you!

What You Will Be Doing

Taking high-fidelity UI designs and transforming them into interactive and efficient mobile app features
Integrating screens with our modern GraphQL APIs, ensuring data consistency and responsiveness
Participating in both automated and manual reviews to maintain our standards for clean, modular code
Collaborating with product managers and UX designers to ensure the functionality, reliability, and user-friendliness of the app

What You Won’t Be Doing

Building components from scratch - you'll leverage existing high-quality solutions for efficiency
Getting stuck in endless approval loops - we value swift decision-making and autonomy
Isolated tasks - you will collaborate closely with a supportive product and backend team

Senior Mobile Developer Key Responsibilities

Delivering a high-quality application that serves as the primary interface for students in our cutting-edge computer-based learning environment

Basic Requirements

At least 5 years of experience developing mobile applications
At least 2 years in a leadership role, making technical design decisions for mobile applications
Experience using React Native for cross-platform app development

About Gt.school

GT School is an EdTech Startup that leverages technology, AI, and subject matter experts to cultivate a new way of learning. Our unique approach leverages 50+ years of learning science, cutting-edge data analytics and high-performance coaching. In doing so, we can help students learn more, learn faster, and learn better - and have fun while doing it. We are a remote-first company that hires globally via Crossover.

There is so much to cover for this exciting role, and space here is limited. Hit the Apply button if you found this interesting and want to learn more. We look forward to meeting you!

Working with Crossover

This is a full-time (40 hours per week), long-term position. The position is immediately available and requires entering into an independent contractor agreement with Crossover. The compensation level for this role is $50 USD/hour, which equates to $100,000 USD/year assuming 40 hours per week and 50 weeks per year. The payment period is weekly. Consult www.crossover.com/help-and-faqs for more details on this topic.

What to expect next:

You will receive an email with a link to start your self-paced, online job application.
Our hiring platform will guide you through a series of online “screening” assessments to check for basic job fit, job-related skills, and finally a few real-world job-specific assignments.

Important! If you do not receive an email from us:

First, emails may take up to 15 minutes to send, refresh and check again.
Second, check your spam and junk folders for an email from Crossover.com, mark as “Not Spam” since you will receive other emails as well.
Third, we will send to whatever email account you indicated on the Apply form - by default, that is the email address you use as your LinkedIn username and it might be different than the one you have already checked.
If all else fails, just reset your password by visiting https://www.crossover.com/auth/password-recovery if you already applied using LinkedIn EasyApply.

Crossover Job Code: LJ-4581-PH-NCRNatio-SeniorMobileDe.024","Android Development
Add,Application Programming Interfaces (API)
Add,Back-End Web Development
Add,Mobile Application Development
Add,Mobile Applications
Add,React Native
Add,Swift (Programming Language)
Add,Technical Design
Add,User Interface Design
Add,iOS Development
Add,"
Application Developer - MuleSoft,"Risewave Consulting Inc. · Quezon City, National Capital Region, Philippines Reposted 2 days ago · 19 applicants",Hybrid Contract Associate,"About the job
Job Description:
 We are seeking a highly skilled and experienced Application Developer with expertise in MuleSoft, specifically MuleSoft 4, Any Point Studio, and runtime 4.4.0. The ideal candidate will have a strong background in MuleSoft integration and will play a critical role in designing, developing, and maintaining MuleSoft applications. Additionally, the candidate should be proficient in MuleSoft on RTF (Real-Time Framework), the OpenShift platform, and Cloud hub environment. Exposure to Tibco is considered an advantage. This position requires a minimum of 3 to 4 years of MuleSoft experience, including production support activities and a commitment to meeting service level agreement (SLA) commitments.

Qualifications:
Bachelor's degree in Computer Science, Information Technology, or a related field (or equivalent work experience).
Minimum of 3 to 4 years of hands-on experience with MuleSoft, including MuleSoft 4 and AnyPoint Studio.
Strong knowledge of MuleSoft on RTF and the OpenShift platform.
Proficiency in Cloudhub environment for MuleSoft applications.
Exposure to Tibco is considered an advantage.
Strong problem-solving, analytical, and troubleshooting skills.
Excellent communication and collaboration skills.
Detail-oriented with a commitment to delivering high-quality solutions.
Knowledge of Service Now, Git, Gitlab, and CICD Pipeline.
Previous experience in system administration tasks and production support activities.","Computer Science
Add,Continuous Integration and Continuous Delivery (CI/CD)
Add,Git
Add,Gitlab
Add,MuleSoft Anypoint Platform
Add,MuleSoft CloudHub
Add,OpenShift
Add,Problem Solving
Add,Service-Level Agreements (SLA)
Add,Troubleshooting
Add,"
Senior BI Developer - Power BI (Nightshift),"Pontoon Solutions · Manila, National Capital Region, Philippines Reposted 1 week ago · 32 applicants",Hybrid Full-time,"About the job
About The Role

The Senior Business Intelligence Developer works as a part of the Business Intelligence Team. This role is responsible for ensuring consistent, accurate, and efficient design and development of reports and dashboards as well as modifications to existing analytics within Pontoon’s Business Intelligence Platform. The Senior Business Intelligence Developer works with Business Intelligence Analysts and/or the Program Team to manage reporting standards and document any client-specific changes to said standards, as well as represents Pontoon BI and other Business Intelligence Developers as a subject matter expert and role model on Pontoon report creation, design, and standards. The developer is responsible for designing and implementing creative solutions to extract data from different source systems and endpoints and pulling into Pontoon’s environment in an automated fashion. This role ensures that requestor requirements are met and assists in guiding change management and adoption of Pontoon Standard Reports and Analytics within the programs. Direct interface

with internal program teams and client stakeholders required as needed. This role works with the internal Data Warehouse, Data Science, and Data Governance teams to translate product and warehouse requirements needed for development and ensure documentation of integration reports are accurate and compliant with Pontoon’s standards.

What You’ll Be Doing

 Partners with BI Leaders, Project Managers, and SMEs to evaluate the feasibility of and provide timetables for executing requirements.
 Translates business requirements into meaningful, clean, and scalable visualizations built according to established Pontoon Business Intelligence & Analytics best practices.
 Partners with Data Services to ensure optimal data organization to enable efficient reporting capabilities.
 Works with Data Science to productize their code and algorithms into the Pontoon BI environment
 Designs creative solutions to automate extraction and migration of data from different source systems into the Pontoon BI environment
 Provides production support for published Business Intelligence solutions.
 Evaluates requirements and connect to the proper data sources at the appropriate aggregation level.
 Researches and learns new technological capabilities to drive our offerings forward.
 Utilizes SQL, Python, R, or Java scripting to improve product quality and effectiveness.
 Provides hands on Business Intelligence reporting and support for all Business Intelligence & Analytics team members as needed.
 Works as a SME and mentor to Business Intelligence Developers on Pontoon’s BI and Analytics team.
 Pushes Pontoon Standards with regards to report creation, design, security, and aesthetics.
 Documents requirements for the Pontoon Data Warehouse and Data Governance teams.
 Identifies and creates efficiencies within and across products.
 Participates in special projects and performs other duties as assigned.

About You

EDUCATION & JOB REQUIREMENTS:

Bachelor’s Degree preferably in Business, Technology, or a related field with a minimum of five (5) years of experience in a business intelligence analytics role and five (5) years of experience developing reports and dashboards in business intelligence tools.

Demonstrated experience with Power BI development.

Prior experience working as part of a team with a common goal and shared responsibilities.

Experience managing multiple development projects at one time is required.

Working experience with SQL, Python, R, or Java scripting.

Experience with extracting and modeling data from an API/JSON.

Direct experience working with and manipulating raw data, familiarization with data aggregation levels.

Experience with technologies utilized in the human resources or talent acquisition/management fields and their resultant data is highly desired.

Experience in the staffing and contingent workforce industries is highly desirable.

Experience working with Power BI and/or other Business Intelligence visualization tools.

Knowledge, Skills & Abilities

 Skilled in communicating effectively verbally and in writing.
 Ability to establish and maintain effective working relationships.
 Ability to understand end-user needs and assist in the development of business analytics products.
 Ability to demonstrate strong analytical skills and pick up new technologies quickly.
 Ability to work effectively both independently and in a group or team environment.
 Ability to prioritize, organize and perform multiple work assignments simultaneously while meeting

assigned deadlines.

 Ability to identify how best to visualize a given data set and to create those visualizations.
 Ability to transform business-level requirements to actionable dashboards and visualizations.
 Proficient with Microsoft Office products, such as Word, Excel,PowerPoint, and Outlook

Why choose us?

It’s an exciting time to be part of our team. We’re proud to be a global thought-leader and care about doing the best job we can to ensure better futures for everyone. We do this by building our Future@Work strategy as a united team of 30,000+ colleagues with a collective spirit working in over 60 countries globally.

You’ll have the opportunity to grow across a variety of interesting jobs and careers over our extensive portfolio of global brands. We empower our colleagues to work in the smartest, most efficient ways to achieve total balance between the demands of their jobs and their lives. That’s why we give you the autonomy and support you need to work in the way that makes you most productive, agile, confident, and insightful.

Putting people first, pioneering with a collective spirit and always advancing with a growth mindset -that’s what we stand for at the Adecco Group. Here, we are all individuals with a unique perspective on the world we live in. That’s what makes us stronger. Whoever you are and whatever your background, you can be yourself. So, we aim to build on the attributes that make you, you. We offer a range of world-class resources for upskilling and development, satisfying your curiosity while the sharing skills, knowledge, and expertise to grow together.

Make an impact where it matters most.

A journey to bring out the best in you

We believe that having an understanding of the hiring process helps you to prepare, feel, and be, at your best. As a global, multi brand organization with multiple different roles, our application process can vary.

On our career site, you will find some of the key steps you can expect to guide you along the way.

As one of the world’s largest employers we believe in talent, not labels, and focus on the diverse and unique skills our people bring. We seek to foster a culture of belonging and purpose, an environment where everyone can thrive and feel engaged, and where difference is respected and valued. Our commitment to equity, equal opportunity, inclusion, and diversity is part of our broader commitment to respecting fundamental human rights across our value chain. The Adecco Group is proud to be an Equal Opportunity Employer.

JobIndustry: Pontoon

Job Code :APAC00202","Analytics
Add,Business Intelligence (BI)
Add,Business Requirements
Add,Business Transformation
Add,Dashboards
Add,Data Analytics
Add,Data Governance
Add,Data Warehousing
Add,Real Estate Development Projects
Add,Visualization
Add,"
Game Designer,Staffing Ninja · Philippines 1 week ago · 19 applicants,Remote Full-time Mid-Senior level,"About the job
Roles & Responsibilities:

Develop engaging in-game content, including characters, stories, settings, features, mechanics, systems, loops, economy, and world-building across various projects.
Stay updated on gaming market trends, utilizing insights as a foundation for new ideas and improvements.
Act as the primary advocate for continuous refinement of the overall player experience and game direction.
Create and maintain comprehensive game design documents, effectively communicating concepts and requirements to team members in different disciplines.
Collaborate with the team to develop paper and digital game system prototypes.
Identify stakeholders and assess their influence on features.
Design UI wireframes, flowcharts, and data models mapping out core gameplay aspects.
Collaborate closely with Game Programmers and Artists, aligning and iterating on the overall project vision.
Optimize and ensure the balance of game features through team feedback, QA, and playtesting at every stage of production.

Skills & Requirements:

Minimum 3-5 years of experience in Game Design & Development.
Experience with PC & Console games is advantageous.
Advanced knowledge of designing in Unity3D or Unreal Engine is a must.
Familiarity with common algorithms, design patterns, and structures.
Experience working on and shipping features for high-profile games with a significant number of daily active users, ideally on a mobile platform.
Experience working with external developers and A/B split testing.
Experience working as a horizontal leader of cross-functional teams, including design, engineering, production, etc.

Good to have:

Proficiency in English is required.
Proficiency in Chinese or Japanese would be advantageous.
Knowledge or experience with Web 2 / Web 3 is a plus.

Benefits:

It is a Full-Time Remote Opportunity.","A/B Testing
Add,Console Games
Add,Design Patterns
Add,Game Design
Add,Game Design Documents
Add,Game Development
Add,PC Games
Add,Playtesting
Add,Unity
Add,Unreal Engine
Add,"
Business Intelligence (BI) Report / Dashboard Developer,"Computer Professionals Inc. · Makati, National Capital Region, Philippines 2 weeks ago · 39 applicants",Hybrid Contract Associate,"About the job
For over 34 years, Computer Professionals, Inc. (CPI) has evolved into an innovative technology company that delivers high-quality software services and solutions. CPI, as an IT company that has been working with top global companies, continues to provide exceptional IT services and solutions through a culture of quality and continuous improvement to our customers. We invest in recruiting talented individuals and bring the best opportunities for their careers where they can build and share meaningful experiences together with its employees.

REQUIREMENTS:
2-4 years experience as Report Developer
Experience in Reporting tools such as PowerBI(*), SiSense(*), GDP, Tableau, Quicksight
Okay with project-based type of employment
Okay to work onsite once or twice a week in Makati

Nice to have: 
Experience in log analysis, defect analysis, static and dynamic code reviews
Cloud familiarity
Able to translate business requirements into technical requirements

JOB SUMMARY:
Collaborate with different business units to understand their reporting and analytical needs, provide expert recommendation on dashboard building and deliver actionable insights to relevant decision-makers. Create and maintain rich interactive visualizations through data interpretation and analysis, by combining multiple data sources and using reporting tools such as PowerBI, Sisense and other similar technologies.","Amazon QuickSight
Add,Analytical Skills
Add,Business Intelligence (BI)
Add,Business Requirements
Add,Cloud Computing
Add,Dashboards
Add,Data Analytics
Add,Data Interpretation
Add,Defining Requirements
Add,Microsoft Power BI
Add,Reporting
Add,"
"Security Engineer, Projects","Thrive · Clark Freeport and Special Economic Zone, Central Luzon, Philippines Reposted 1 week ago · 76 applicants",On-site Full-time Entry level,"About the job
Location: Philippines Office

About Us:

Thrive is a rapidly growing technology solutions provider focusing upon Cloud, Cyber Security, Networking, Disaster Recovery and Managed Services. Our corporate culture, engineering talent, customer-centric approach, and focus upon “next generation” services help us stand out amongst our peers. Thrive is on the look-out for individuals who don’t view their weekdays spent at “a job”, but rather look to develop valuable skills that ignite their passion and lead to a CAREER. If you’re attracted to a “work hard, play hard” environment, seeking the guidance, training, and experience necessary to build a lucrative career, then welcome to THRIVE!!

Position Overview:

With a growing client base, Thrive Networks is continuing to build out our security team. We are looking to hire a Security Engineer to take a lead role in the deployment of our Endpoint Detection and Response service offerings, 24/7 Security monitoring, and vulnerability management. The ideal candidate will have a passion for information security with a solid understanding of networking concepts and how security software works.

Primary Responsibilities:

Deploy SIEM, EDR, Vulnerability Management software as part of rolling out Security Services. 
Assist with alarm tuning and configuration tasks necessary for Security Service deployments for new and existing customers. 
Assist other teams with troubleshooting security software.
Ensure all security software is deployed following industry best practices. 
Implementation of API security measures, ensuring secure data transmission and compliance with industry-standard API security protocols.
Work closing with project managers to better enhance the onboarding experience with for our clients.
Join any Internal Kickoff or External Kickoff calls as needed.
Creation and ongoing upkeep of materials documenting our security processes, procedures, and technologies.
Collaborate with clients to understand their reporting needs and requirements and customize reports and dashboards accordingly.
Assist with analyzing vulnerability scans and determining remediation steps.

Qualifications:

Solid understanding of network protocols, operating systems, application layer protocols, and security best practices. 
Understanding cybersecurity threats and incident response standards and procedures.
Ability to communicate security information to non-technical people.
Has a passion for Cyber Security.
Demonstrates comprehension of good security practices
Has worked with ServiceNow.

Required Skills:

Ability to analyze a large amount of data from various sources and use this information to solve complex problems and make good decisions. Must be able to work effectively in a team environment and collaborate within the team and other stakeholders.
Excellent Written and Verbal Communication Skills
Solid understanding of networking & security software
Is familiar with or has worked with vulnerability discovery and analysis.
Operating System Internals
Familiarity with TCP/IP network protocols, application layer protocols (e.g., HTTP, SMTP, DNS, etc.).

Preferred Skills:

Knowledge of common Windows and Linux/Unix system calls and APIs
Understand Anti-Virus
Knowledge of programming languages.
Knowledge of internal file structures for file formats commonly associated with malware (e.g., OLE, RTF, PDF, EXE, etc.)

This is a full-time position in our Clark office in the Philippines. All applicants should be living in, or be willing to relocate to, that area and are expected to work out of the office on a daily basis.","Application Security
Add,Communication
Add,Communication Protocols
Add,Cybersecurity
Add,Dashboards
Add,Incident Response
Add,Information Security
Add,Vulnerability
Add,Vulnerability Assessment
Add,Vulnerability Management
Add,"
