Title,CompanyDetails,JobDetails,JobDescription,JobSkills
Senior Data Engineer,"Manulife · Makati, National Capital Region, Philippines Reposted 1 week ago · 20 applicants",Full-time Mid-Senior level,"About the job
We are a leading financial services provider committed to making decisions easier and lives better for our customers and colleagues around the world. From our environmental initiatives to our community investments, we lead with values throughout our business. To help us stand out, we help you step up, because when colleagues are healthy, respected and meaningfully challenged, we all thrive. Discover how you can grow your career, make impact and drive real change with our Winning Team today.

Working Arrangement

Hybrid

Job Description

The Opportunity 

The customer is the focus of everything we do, and millions of end users rely on our products daily. We believe in the value of empowering Scrum Masters with the resources to solve critical problems for the future of our business, which is why we need you.

The Asia Data Office is looking for an experienced Senior Data Engineer to join our team to support our regional partners. If you have passion for data and a desire to drive quality data solutions within a data driven culture, then read on to learn more about this opportunity!

We are looking for the right individual who would be interested and enjoy the opportunity to support data operations, strong willingness to learn and build data operations skills through team collaboration, desire to drive and execute on our data strategy, willing to help mature our agile practices, and is looking for an opportunity to embrace technical, operational, and informal leadership roles on the team.

What motivates you? 

 You obsess about customers, listen, engage and act for their benefit
 You think big, with curiosity to discover ways to use your agile mindset and enable business outcomes
 You thrive in teams, and enjoy getting things done together
 You take ownership and build solutions, focusing on what matters
 You do what is right, work with integrity and speak up
 You share your humanity, helping us build a diverse and inclusive work environment for everyone

We Are Looking For Someone With

Proficient understanding of distributed computing principles 
Good Knowledge of Hadoop cluster, Azure, with all included services 
Ability to solve any ongoing issues with operating the cluster 
Proficiency with Hadoop v2, MapReduce, HDFS
Experience with Azure ADLSg2, Data Factory, DataBricks, Eventhub,
Experience with data engineering projects i.e integration of data from multiple data sources to a target system
Good knowledge of Big Data querying tools – Hive, HBase, SQL
Knowledge in data streaming (e.g. Kafka, Spark)
Knowledge in any server-side programming languages (e.g. Java, Python, Spark, R…etc)
Knowledge in any Change Data Capture (CDC) solutions
Experience in working on Agile projects is an advantage.
Experience on Azure Cloud and/or other Cloud platforms
Open Source RDBMS management including MongoDB & HBase

Education And Experience

Bachelor's degree preferably in Computer Science or Data/Engineering related courses
Recognized qualification in Service Management helpful
ITIL certification helpful
10+ years in one or more of the following
Data Engineer
Platform Engineer
DevOps Engineer
Systems Engineer
Systems Administrator

On The Job You Will

Duties

Selecting and integrating any Big Data tools and frameworks required providing requested capabilities 
Implement ETL/ELT flows via Big Data Solutions i.e Nifi, Spark, Python, Azure Data Factory, Azure Synapse, Azure DataBricks…etc
To be able to monitor the performance and advice necessary infrastructure changes or performance tuning in codes.
Support business users in use of the Enterprise Data Lake (EDL) as part of BAU
Perform POC on new integration patterns and solutions.
Maintain and monitor platform stability and performance of EDL
Attends to Incidents and change requests
Write and maintain technical documentation
Perform unit tests and system integration tests
Executes updates, patches, and other activities required to maintain and enhance the operations of the EDL
Supports the Agile delivery squads when required

 Our commitment to you 

Our mission; to be a part of making Decisions Easier and Lives Better
A leadership team dedicated to your growth and success 
A bold ambition and set of goals to be a leader in driving transformation in our industry 
Our best. Every day. 

Learn more about opportunities with us at jobs.manulife.com

About Manulife And John Hancock

Manulife Financial Corporation is a leading international financial services group that helps people make their decisions easier and lives better. With our global headquarters in Toronto, Canada, we operate as Manulife across our offices in Asia, Canada, and Europe, and primarily as John Hancock in the United States. We provide financial advice, insurance, and wealth and asset management solutions for individuals, groups and institutions. At the end of 2022, we had more than 40,000 employees, over 116,000 agents, and thousands of distribution partners, serving over 34 million customers. At the end of 2022, we had $1.3 trillion (US$1.0 trillion) in assets under management and administration, including total invested assets of $0.4 trillion (US $0.3 trillion), and segregated funds net assets of $0.3 trillion (US$0.3 trillion). We trade as ‘MFC’ on the Toronto, New York, and the Philippine stock exchanges, and under ‘945’ in Hong Kong.

Manulife is an Equal Opportunity Employer

At Manulife/John Hancock, we embrace our diversity. We strive to attract, develop and retain a workforce that is as diverse as the customers we serve and to foster an inclusive work environment that embraces the strength of cultures and individuals. We are committed to fair recruitment, retention, advancement and compensation, and we administer all of our practices and programs without discrimination on the basis of race, ancestry, place of origin, colour, ethnic origin, citizenship, religion or religious beliefs, creed, sex (including pregnancy and pregnancy-related conditions), sexual orientation, genetic characteristics, veteran status, gender identity, gender expression, age, marital status, family status, disability, or any other ground protected by applicable law.

It is our priority to remove barriers to provide equal access to employment. A Human Resources representative will work with applicants who request a reasonable accommodation during the application process. All information shared during the accommodation request process will be stored and used in a manner that is consistent with applicable laws and Manulife/John Hancock policies. To request a reasonable accommodation in the application process, contact recruitment@manulife.com.","Analytics
Add,Azure Data Factory
Add,Big Data
Add,Change Data Capture
Add,Data Engineering
Add,Data Integration
Add,Databases
Add,Hadoop
Add,Hive
Add,Technical Documentation
Add,"
L1 Site Reliability Engineer,"Maya · Mandaluyong, National Capital Region, Philippines 2 weeks ago · 52 applicants",Hybrid Full-time Entry level,"About the job
Job Opportunity:

24x7 (12x4) shifting schedule 
Investigate & resolve incidents & escalations or fulfill requests 
Communicate service interruption / degradation or system maintenances to internal & external customers 
Assess production changes 
Write custom service checks & detect events 
Analyze the system & be able to arrest errors & address gaps to the processes 
Build dashboards & reduce overhead to operations 
Collaborate effectively with other business units 

Job Responsibilities:

The engineer should be able to identify gaps, investigate & resolve problems within SLA 
The engineer should be able to manage the incidents & request fulfillments within SLA 
The engineer should be able to come up with ideas & solution that will help improve operational processes (incident detection, resolution, prevention, etc) 
The engineer should be able to help keep the system error & downtime to a minimum 
The engineer should be able to build custom service checks & dashboards 
The engineer should be able to assess production changes & anticipate potential issues 
The engineer should be able to automate process handling 
The engineer should be able to ensure all scheduled tasks or batch jobs were completed without issues 

Job Qualifications:

At least a Bachelor’s degree in Computer Science 
At least 3 years of experience in IT Operations & Service Management 
Experience in Splunk searching is an advantage 
At least 1 year experience in managing AWS cloud resources 
At least 2 year experienced in process automation 
Knowledge in Linux, IT Security & PCIDSS","Amazon Web Services (AWS)
Add,Bash
Add,Computer Science
Add,DevOps
Add,ITIL
Add,Linux
Add,Perl
Add,SQL
Add,Splunk
Add,Windows
Add,"
Junior Data Engineer Web Scraping,"Recruiter PH · Quezon City, National Capital Region, Philippines 6 days ago · 0 applicants",On-site Full-time Mid-Senior level,"About the job
This job is sourced from a job board. Learn More
Description

Are you right for the role?

We’re looking for people who have an obsessive passion for learning. We don’t care if you are young or old, or even if you have a degree. But we care that you are a passionate programmer with a gnawing hunger for learning new things. As a big data company, we live to hoard information and we expect our people to have the same drive when it comes to learning. For this particular role, if you can offer the stuff (below), you might want to apply.

 Demonstrable experience in coding using HTML5, CSS3, Javascript and Python
 Familiarity with database management systems such as MySQL or MongoDB
 Basic understanding of Linux OS is a plus
 Strong problem-solving skills
 The ability to communicate directly with peers and managers while leading development to a completed and successful solution
 Familiarity with data modeling and schema design principles.",
"Infrastructure Cloud Engineer, Lead",3Cloud · Philippines 1 week ago · 30 applicants,Remote Full-time Mid-Senior level,"About the job
This remote position is a crucial part of our global SRE team, responsible for developing and implementing robust, scalable, and efficient systems that align with our client’s business goals and SRE principles. The ideal candidate will have a strong background in DevOps methodologies and a demonstrated ability to work effectively with remote teams.

Key Responsibilities:

Develop and implement automated systems and infrastructure for continuous integration, continuous deployment, monitoring, and site reliability.
Collaborate with US Based and other GDC team members to design, build, and implement SRE/DevOps solutions that meet business requirements and goals.
Identify and troubleshoot issues related to system performance, reliability, and scalability.
Work closely with architects and engineers to incorporate efficient and effective solutions into the overall architecture and design.
Contribute to the development and improvement of SRE and DevOps standards, guidelines, and procedures.
Document and maintain system configurations, procedures, and changes.
Participate in the on-call rotation, providing off-hours support as needed.
Participate in agile development processes and project management practices.

Qualifications:

Proven experience as a DevOps Developer, SRE Engineer, or a similar role in a technical environment.
Deep understanding of SRE principles and practices, with extensive experience in DevOps methodologies.
Proficiency in using Azure platforms, containerization technologies (like Docker, Kubernetes), monitoring tools (like Prometheus, Grafana), and CI/CD tools.
Strong communication skills, with a demonstrated ability to work effectively with remote teams.
Excellent problem-solving capabilities and a detail-oriented mindset.
Experience working in an agile development environment and familiarity with related tools and practices.

Preferred Candidate Qualifications:

Technical Expertise in Terraform: Experience in writing and managing infrastructure as code using Terraform. Understanding of Terraform principles, modules, state management, and best practices.
Proficiency in Microsoft Azure: Deep understanding of Microsoft Azure services and architectures, with experience in deploying and managing infrastructure on Azure using Terraform.
Scripting Skills: Proficiency in at least one scripting language, such as Python, Bash, PowerShell, or similar, for automation tasks and custom scripting requirements.
Experience in CI/CD Pipeline: Experience with Continuous Integration/Continuous Deployment pipelines and deploying Terraform through a pipeline. Familiarity with CI/CD tools like Jenkins, Azure DevOps, GitHub Actions, or similar.
Understanding of SRE Principles: Knowledge of Site Reliability Engineering (SRE) principles and practices, including automation, proactive monitoring, and reliability-focused system design.
Cloud Security Knowledge: Understanding of security concepts related to cloud computing and cloud-native applications. Familiarity with Azure security best practices and how to implement them in Terraform.
Version Control Systems: Experience with version control systems such as Git for tracking changes in code during software development.
DevOps Practices: Experience with DevOps practices and methodologies, emphasizing automation, infrastructure as code, and system reliability.
Problem-Solving Skills: Excellent problem-solving capabilities, with the ability to troubleshoot and resolve infrastructure issues efficiently.
Certifications: Microsoft Certified: Azure DevOps Engineer Expert, HashiCorp Certified: Terraform Associate, or similar certifications would be advantageous

Don’t meet every single requirement? At 3Cloud we are dedicated to building a diverse, inclusive and authentic workplace, so if you’re excited about this role but your past experience doesn’t align perfectly with every qualification in the job description, we encourage you to apply anyway.","Cloud Development
Add,GitHub
Add,Infrastructure as code (IaC)
Add,Microsoft Azure
Add,Systems Engineering
Add,Terraform
Add,"
"Full Stack Engineer, Prequel (Remote) - $100,000/year USD","Crossover  · National Capital Region, Philippines Reposted 6 days ago · 27 applicants",Remote Full-time Mid-Senior level,"About the job
Crossover is the world's #1 source of full-time remote jobs. Our clients offer top-tier pay for top-tier talent. We're recruiting this role for our client, Prequel. Have you got what it takes?

Are you passionate about leveraging technology to transform education? If you're someone who thrives on creating seamless digital experiences and wants to contribute to shaping the future of learning, we have a role for you.

At Prequel, we're not just creating another web platform; we're revolutionizing education. Our focus on empowering middle and high school students with critical life skills through entrepreneurship and mentorship sets us apart. We're committed to fostering an environment where learning transcends traditional boundaries, and technology becomes a conduit for personal growth and development.

In this role, you will be an integral part of a team dedicated to revolutionizing education through technology. Your contributions will directly impact the enhancement of our student web portal, enabling us to create a platform that not only facilitates learning but also nurtures essential life skills in our future leaders. You will dive into crafting a user-centric web portal, integrating AI feedback mechanisms, and managing database systems, all while embracing continuous improvement methodologies.

If you're passionate about creating meaningful change in education and thrive in a collaborative, innovative environment, join us at Prequel. Become part of a team that's redefining how technology can shape the next generation's learning journey.

What You Will Be Doing

Web Portal Development: Focusing on a user-centric web portal with emphasis on seamless user experience, AI feedback integration, diverse input handling, curriculum management, and a robust system for webhook integration.
Database Management and Integration: Managing connections to preferred systems (Airtable or Google Firebase) to efficiently process user submissions and AI feedback, while ensuring error handling, scalability, and performance optimization.
Interface and Feedback Integration: Creating user-friendly interfaces using design tools, integrating AI feedback mechanisms through API, and continuously improving functionalities through Agile methodologies and CI/CD practices.

What You Won’t Be Doing

Solely Technical Development: This role extends beyond traditional technical development; it's about contributing to an educational platform dedicated to fostering life skills in students.
Isolated Development: You won't work in isolation; collaboration with cross-functional teams and stakeholders is vital for success.

Full Stack Engineer Key Responsibilities

Enhancement of the user experience on the student web portal, leading to a higher user retention rate and subsequently greater user numbers

Basic Requirements

Proficiency in HTML, CSS, JavaScript/TypeScript, and React
Proficiency in a server-side language, such as Node.js, Python, or Ruby, and an understanding of server architecture, microservices, and hosting technologies like AWS and EC2
Familiarity with database managements tools, such as PostgreSQL, Airtable, and Google Firebase

About Prequel

Prequel is a group of education brands that help the world's most ambitious kids learn 21st-century life skills by building projects with real-world feedback and impact. Through entrepreneurship and world-class mentors, Prequel helps middle and high school students build critical life skills not taught in school.

We believe that the best way to learn anything is through entrepreneurship.

We take teens from potential to progress. We believe that society underestimates what ambitious teens can achieve.

Starting now, teens can find what they're passionate about and accelerate their careers by getting hands-on experience - instead of waiting to ""grow up.”

There is so much to cover for this exciting role, and space here is limited. Hit the Apply button if you found this interesting and want to learn more. We look forward to meeting you!

Working with Crossover

This is a full-time (40 hours per week), long-term position. The position is immediately available and requires entering into an independent contractor agreement with Crossover. The compensation level for this role is $50 USD/hour, which equates to $100,000 USD/year assuming 40 hours per week and 50 weeks per year. The payment period is weekly. Consult www.crossover.com/help-and-faqs for more details on this topic.

What to expect next:

You will receive an email with a link to start your self-paced, online job application.
Our hiring platform will guide you through a series of online “screening” assessments to check for basic job fit, job-related skills, and finally a few real-world job-specific assignments.

Important! If you do not receive an email from us:

First, emails may take up to 15 minutes to send, refresh and check again.
Second, check your spam and junk folders for an email from Crossover.com, mark as “Not Spam” since you will receive other emails as well.
Third, we will send to whatever email account you indicated on the Apply form - by default, that is the email address you use as your LinkedIn username and it might be different than the one you have already checked.
If all else fails, just reset your password by visiting https://www.crossover.com/auth/password-recovery if you already applied using LinkedIn EasyApply.

Crossover Job Code: LJ-5176-PH-NCRNatio-FullStackEngin","Amazon EC2
Add,Cascading Style Sheets (CSS)
Add,Full-Stack Development
Add,HTML
Add,JavaScript
Add,Microservices
Add,React.js
Add,Server Architecture
Add,Server Side
Add,TypeScript
Add,"
SQL / ETL Developer,"Eclaro · Taguig, National Capital Region, Philippines 2 weeks ago · 37 applicants",Hybrid Full-time Mid-Senior level,"About the job
SQL/ETL Developer 
 We are seeking a talented SQL/ETL Developer to join our team. As an SQL/ETL Developer, you will play a critical role in managing and optimizing our data pipelines, transforming raw data into valuable insights for the organization. You will work closely with our data engineering and analytics teams to ensure the availability, accuracy, and timeliness of data for business decision-making.
 Key Responsibilities:
 -Design, develop, and maintain ETL processes to extract, transform, and load data from various sources into data warehouses or data lakes. 
-Write and optimize SQL queries to access and manipulate data from relational databases, ensuring data quality and performance. 
-Collaborate with data engineers and data scientists to understand data requirements and develop data models that support analytical and reporting needs.
-Troubleshoot and resolve data-related issues and performance bottlenecks in ETL processes and SQL queries. 
-Monitor and maintain data pipelines, ensuring data accuracy, integrity, and security.
-Collaborate with cross-functional teams to gather data requirements and provide data support for business initiatives.
-Stay up-to-date with industry best practices and emerging trends in SQL and ETL development.
 Qualifications:
-Bachelor's degree in Computer Science, Information Technology, or a related field. 
-Proven experience as an SQL/ETL Developer or similar role, with a strong understanding of database design and data warehousing concepts.
-Proficiency in SQL and experience with database management systems (e.g., Oracle, SQL Server, PostgreSQL).
-Solid experience with ETL tools and processes, such as Apache NiFi, Talend, Informatica, or custom ETL scripting.
-Strong analytical and problem-solving skills, with the ability to work with large datasets.
-Excellent communication and teamwork skills to collaborate with cross-functional teams.
-Knowledge of data integration best practices, data quality, and data governance.
-Familiarity with data visualization tools (e.g., Tableau, Power BI) is a plus.
 Optional Skills and Certifications:
Experience with cloud-based data platforms (e.g., AWS, Azure, GCP).
Certifications in SQL, ETL, or data warehousing technologies

Other information: 
-Night Shift - 9PM to 6AM
-Hybrid Set up in BGC or QC | 3 days onsite and 2 days WFH
-Competitive Salary - Negotiable depending on experience level
-HMO - Maxicare
-35 combined leave credits
-More perks and benefits await!","Amazon Web Services (AWS)
Add,Apache NiFi
Add,Computer Science
Add,Data Warehousing
Add,Database Design
Add,Databases
Add,Extract, Transform, Load (ETL)
Add,Google Cloud Platform (GCP)
Add,PostgreSQL
Add,SQL
Add,Talend
Add,"
