Title,CompanyDetails,JobDetails,JobDescription,JobSkills
Platform Engineer,"Capgemini · Manila, National Capital Region, Philippines Reposted 1 month ago · 97 applicants",Hybrid Full-time Mid-Senior level,"About the job
About Capgemini

Capgemini is a global leader in partnering with companies to transform and manage their business by harnessing the power of technology. The Group is guided everyday by its purpose of unleashing human energy through technology for an inclusive and sustainable future. It is a responsible and diverse organization of over 360,000 team members in more than 50 countries. With its strong 55-year heritage and deep industry expertise, Capgemini is trusted by its clients to address the entire breadth of their business needs, from strategy and design to operations, fueled by the fast evolving and innovative world of cloud, data, AI, connectivity, software, digital engineering and platforms. The Group reported in 2022 global revenues of €22 billion.

Capgemini Philippines is looking for Platform Engineer (Kubernetes/EKS,AWS) role. Please find the detailed JD below :-

Overall Purpose :-

The Platform Engineer is responsible for designing, implementing, and managing the cloud-native infrastructure and container orchestration platform, primarily based on Kubernetes and Amazon Elastic Kubernetes Service (EKS) within the AWS environment. Their primary objective is to create a secure, scalable, reliable, and highly available platform that enables the deployment and management of containerized applications. They play a crucial role in supporting development teams and ensuring the smooth operation of applications in a cloud-native ecosystem.

Specific Responsibilities :-

Build and support platform capabilities allowing for fast and reliable software development and release to our development teams.
Define platform monitoring requirements and implement automated incident resolution solutions.
Provide support and advice development teams to enable efficient operation and problem resolution.
Recommend solutions and assist in overseeing implementation. Actively facilitate continuous improvement.
Provide technical input to the creation of cloud services and foundations proposals in technical review meetings and for presentation to guarantee best practice.
Drive adoption of key engineering best practices, supporting team members to improve quality, efficiency, and reliability of deliverables.
Identify areas for process and efficiency improvement within the platform.
Monitor various platform capacity and health indicators and trends; provide analytics & forecasts for added or reduced capacity as required.

Technical Experience :-

Extensive experience in managing Kubernetes clusters, preferably on Amazon & Google, including cluster setup, configuration, and maintenance.
Strong familiarity with GCP and Amazon Web Services (AWS) and its various services, such as EC2, VPC, IAM, RDS, SQS, ECS and Route 53, to design and optimize cloud infrastructure.
Proficiency in container technologies like Docker, container registries, and container networking to facilitate seamless deployments.
Expertise in using Infrastructure as Code (IaC) tools like Terraform, Ansible or CloudFormation for automating cloud resource provisioning and management.
Experience integrating Kubernetes deployments into CI/CD pipelines using tools like Jenkins, GitLab CI/CD, or AWS CodePipeline.
Familiarity with monitoring and logging tools like CloudWatch, Dynatrace Prometheus, Grafana, ELK stack to monitor Kubernetes clusters and applications.
Knowledge of networking concepts, including load balancers, ingress controllers, and network policies, to ensure secure and efficient communication within the platform.
Understanding of container and cloud security best practices, along with hands-on experience in implementing security measures within Kubernetes and AWS.

The Platform Engineer plays a critical role in designing and maintaining the cloud-native infrastructure and Kubernetes platform, ensuring its reliability, security, and performance for hosting containerized applications. They enable efficient development workflows, enhance application scalability, and contribute to the organization's overall success in the cloud-native ecosystem.

Let's talk about what's in it for you!

Passionate people are Capgemini's Ace of Spades - join us to discover a career that will challenge, support and inspire you. Working at Capgemini you'll find the rewards are more than just financial. You will work alongside some very smart and inspiring people on exciting projects and you will also enjoy incredible benefits. We offer flexible work practices and 40 hours of self-development every year with a huge selection of learning opportunities to choose from.

As ""Architects of Positive Futures"", Capgemini actively supports the community in 3 ways:

Diversity and Inclusion - we believe diversity of thought fuels excellence and innovation, which is why we positively encourage applications from suitably qualified candidates regardless of their gender identity, ethnicity, sexual orientation, religion, ability, intersex status or age. To support our commitment to diversity and inclusion, we celebrate special events and days of significance that are important to our employees such as Diwali, Bastille Day, Pride, IDAHOBIT, IWD and International day of people with Disabilities. Our Employee Resource Groups Women@Capgemini and OutFront support the grassroots passion of employees to drive our diversity agenda and effect change.

Digital inclusion - at Capgemini we are using our skills to drive social impact initiatives focusing on helping society address the impact of the digital and automation revolution. We also provide employees with opportunities to give back to the community through charity projects and volunteer days.

Environmental Sustainability - Capgemini joined the CDP's (Carbon Disclosure Project) prestigious ""A list"" for its commitment to the Net-Zero economy. We are focusing on helping our clients transform towards more sustainable business models and committing to reduce our own carbon emissions (GHG) by 20% per employee by 2020.

Recognized by Ethisphere as one of the World's Most Ethical Companies for the last 8 years in a row, ethics and values are at the heart of Capgemini's corporate culture and business. Embedded in our DNA, our seven values - Honesty, Boldness, Trust, Team Spirit, Freedom, Fun and Modesty - have remained the same since company inception in 1967. To see how we bring these values to life, click here to listen to some of our employee’s stories.

Come join us, bring your whole self to work, create new possibilities for you, your customers and your community and help us to be Architects of Positive Futures.","AWS CloudFormation
Add,Amazon EC2
Add,Amazon Relational Database Service (RDS)
Add,Amazon SQS
Add,Amazon Web Services (AWS)
Add,Ansible
Add,Continuous Delivery (CD)
Add,Continuous Integration and Continuous Delivery (CI/CD)
Add,Docker Products
Add,Terraform
Add,"
Build Engineer (DevOps),"Ubisoft Philippines · Taguig, National Capital Region, Philippines Reposted 1 week ago · 26 applicants",Hybrid Full-time Mid-Senior level,"About the job
Company Description

Welcome to Ubisoft Philippines.

We push creativity and break boundaries, building breathtaking worlds from the ground up. We’ve developed award-winning AAA games, the likes of Assassin’s Creed (AC) Valhalla, Far Cry 6, For Honor, AC: Odyssey, AC: Origins and The Crew 2

Ready to take entertainment to the next level?

Embark on an epic journey and Create the Unknown with us.

Job Description

The Build Engineer will work on automated build, deploy and test systems. Additionally, will support the teams by managing software resources and give access to subsystems.

Responsibilities


Self - sufficiently drive initiatives to expand / optimize / re-factor the build, deploy and testing systems
Develop and maintain the logic necessary to automate the build, deploy and testing
Monitor, configure and administer the build, deploy and test system
Support build, deploy and test system users
Optimize and troubleshoot for the users of the build, deploy and test systems
Support the team by being the point of contact for software installs and / or permission access
Support the submission process (packaging, documentation)
Carry out branching and integration tasks with the assistance of technical leads
Co-responsible for archiving source files throughout the project along with Technical Directors to produce the closing kit
Document and update the build and release processes
Any other ad-hoc duties, if necessary


Qualifications


Experience in the IT and Programming Industry
Knowledge of build tools (NAnt, MSBuild, SCons, CC.NET)
Proficient in a scripting language (eg: Perl, Python)
Proficient in the Windows environment
Knowledge of C#
Knowledge of a source control system (eg:Perforce) is advantageous
Good problem solving skills, resourcefulness and takes initiatives
Ability to work as a team, with good interpersonal and communications skills
Working experience in a complete game production (knowledge of the production cycle) is a bonus


All your information will be kept confidential according to EEO guidelines.

Additional Information

Ubisoft Philippines is a certified Great Place to Work ™ – our people always come first. We enable our teams to succeed in the world stage, where we are proud to take part in the most ambitious projects in gaming.

As our teammate, you will receive the best training, including overseas trips, mentorships, and access to online courses and resources covered by us. The workplace will be your playground, where you can fuel your creativity with free fresh fruits and snacks in the pantry, freshly brewed coffee, soft-served ice cream, and popcorn!

Work-life balance is important to us, which is why you’ll have a flexible work arrangement during the pandemic, on top of free physical & mental health benefits and more.

Come as you are. We value diversity and representation. We empower you to launch your own initiatives with our Diversity & Inclusion council composed entirely of volunteer employees.

Ubisoft’s 20,000 team members, working across more than 30 countries around the world, are bound by a common mission to enrich players’ lives with original and memorable gaming experiences.

We are an equal opportunity employer that believes diverse backgrounds and perspectives are key to creating worlds where both players and teams can thrive and express themselves.

If you are excited about solving game-changing challenges, cutting-edge technologies, and pushing the boundaries of entertainment, we invite you to join our journey and help us create the unknown.","C#
Add,Communication
Add,MSBuild
Add,NAnt
Add,Problem Solving
Add,Scripting
Add,Software Configuration Management
Add,System Testing
Add,Version Control
Add,"
Senior Data Engineer,Turing · Philippines 2 weeks ago · 0 applicants,Remote Full-time Mid-Senior level,"About the job
A rapidly-growing company that is dabbling extensively in retail and institutional brokerage services is looking for a Senior Data Engineer. The engineer should have a thorough understanding of business and possess excellent analytical abilities, allowing them to provide the anticipated benefits to the company. The company’s intuitive trading platform is enabling clients across all walks of life to make major financial decisions by providing them with the highest quality investment opportunities. Candidates who are eager to cinch new heights and build an enviable career would be an ideal fit for this job.

Job Responsibilities:

Combine strong data modeling, integration, and data engineering abilities in Python and SQL
Utilize the Azure stack and stay informed about the Data team's engineering efforts
Possess an opinion on information architecture and how it should be developed to meet functional needs and company goals
Participate actively in the data transformation effort by liaising with the teams responsible for reporting, data science, governance, and business partnerships
Work with the newest technologies in a cloud-based environment in a multidisciplinary team comprising analysts, data scientists, data engineers, and SMEs to improve the caliber of data-based decision-making throughout the company
Participate in the creation of the platform and support for data analytics, guaranteeing standardized and simple data exchange and access
Become familiar with and utilize Databricks, Azure Events Hub, Azure Data Lake, and Synapse
Assist with the development, construction, and upkeep of data pipelines for various data sources and communicate with system owners
Be proficient at ingesting and transforming data in real-time to meet our use cases
Make that all data interfaces are consistent with governance and provide high-quality data tools and capabilities
Make certain that the transformation backlog is sent to the data products, derived tables, and source systems
Analyze complicated data and present your findings
Collaborate closely with other senior and lead engineers to support BAU efforts and develop new products
Troubleshoot BAU-related problems, create a JIRA, and work on process improvements
Encourage others to build on your work and share your knowledge with your teammates
Engage in on-call duties to assist with any significant malfunctions.
Engage in a rotating on-call schedule for production support
Assist with sporadic data requests and operational problems

Job Requirements:

Bachelor’s/Master’s degree in Engineering, Computer Science (or equivalent experience)
At least 10+ years of relevant experience as a data engineer
10+ years of experience in a data engineering capacity with exceptional hands-on abilities 
Data Engineering certification as an Azure Data Engineer or Google Certified Professional
Ability to oversee initiatives on an individual basis
Extensive knowledge of Python, Pyspark, and SQL
Working knowledge of and comprehension of Azure Databricks, Azure Events Hub, Azure Data Lake, and Azure Synapse
Strong experience in data warehousing, big data processing, ETL workflow design, and data pipeline architecture
Proven background in creating Python frameworks
Extensive background in analytics solutions and data mapping for business processing.
Substantial expertise in the concepts of corporate data modeling
Strong debugging and troubleshooting abilities
Excellent English communication skills, both spoken and written","Big Data
Add,Computer Science
Add,Data Engineering
Add,Data Modeling
Add,Data Pipelines
Add,Data Science
Add,Data Warehousing
Add,Extract, Transform, Load (ETL)
Add,PySpark
Add,Workflow Design
Add,"
Platform Engineer / SRE - Remote (Philippines),Shape Construction · Philippines Reposted 2 weeks ago · 132 applicants,Remote Full-time Mid-Senior level,"About the job
Ever wondered how it would be to revolutionise one of the least digitised industries in the market, alongside a growing and switched-on team? Read on! 

_______________________________
We are Shape.Construction! 

We are digitising the largest and most fundamental industry in the world, the industry that literally builds the foundations of the civilisation we all depend on to spare us from a brutal hunter-gatherer life: CONSTRUCTION

It is one of the least digitised industries in the world but also the largest – 1 in 9 people globally work in the construction industry and it constitutes 11% of global GDP.

Improving construction strengthens the very foundation of human civilisation. (Watch our short film about it here: youtu.be/PxcBZupiI7Y).

We got our start as a high-end construction project management consultancy. As a consultancy, we are focused on genuinely upgrading the way construction projects are delivered. We then take the deep understanding of the projects we work on to develop construction management software products that anyone can use to deliver their projects better.

We are building a full suite of products one module at a time – kind of like office 365 but for construction management.
(Check out www.shape.construction/, our construction management tech and watch this video about what we are doing. youtu.be/tgi4hW3G_NY)

The core of all this is our true secret sauce; people. We only recruit the very best both in capability and personality. We are deeply focused on designing a new type of organisation that is optimised for the flourishing of the people in the team first and foremost. People that join us develop fast as a whole person in ways they never imagined. (Read more about our vision and mission here www.shape.construction/join-us/).

This approach has allowed us to grow from just 2 people in 2017 to over 160 today (including consultancy) and we are still very much at the beginning! Joining us isn’t just some “job”, it is a transformative educational experience. We challenge you to be your best self in all aspects of life.

_______________________________
4 core values for a good life 

We believe a life of human flourishing is all about meaningful relationships with others and challenging yourself to create a positive impact. So our values reflect the 4 levels of relationships that each of us has:

Grow yourself – Your relationship with yourself
Care about people – Your relationship with others around you
Execute to greatness – Your relationship with your team
Build civilisation – Your relationship with humanity and the world

This goes much deeper but for the sake of brevity, we will keep the summary version!

We enshrined our values in our vision: 

We exist so that everyone in our team can thrive in a high-impact community that:

Connects us with meaningful relationships
Inspires us to develop ourselves to become better humans
Empowers us to pursue our own learning adventures

We believe that, by first doing this, we can achieve the highest levels of value for the world.

And enable the achievement of our vision through our dual missions: 

To fully digitise the construction of human civilisation
To create a new type of organisation that enables human flourishing while delivering a huge positive impact on society

_______________________________
The Role 
We are currently looking for Platform Engineer who crafts the tools to accelerate development and delights our engineers and is capable of architecting our scalable and resilient cloud infrastructure.

Team
Our team is made up of experienced software engineers, product designers and product strategists. Together we will build the digital backbone of a construction organisation.

Your top 3 objectives 
Be the foundation that supports our app's rapid growth.
Design and construct a high-rise platform for our suite of products.
To develop yourself and everyone around you.

Your top 5 responsibilities 
Own Platform: Support the development environment of our software engineers.
Build and develop your team: Lead, grow and develop our amazing platform team, ensuring we stay focused are producing work of exceptional quality and having a lot of fun along the way.
Keep us on the cutting edge: Stay up to date with the latest industry technologies and tools and techniques to ensure we are staying ahead of the rest of the industry.
Infra as code: Terraform all the things!
Develop everyone: Maximise the development of your team personally and professionally and educate.

Your Capabilities 
You are a proven Platform Engineer who setting up observability tools and providing the developers with the necessary means for them to have faster feedback.

Must-Have (The fundamentals)
Mastery: Deep level of knowledge on the frameworks and tools used.
Communication: Good communication is much more than saying the right thing. It is about communicating messages clearly and concisely. Ability to choose the best method of communication based on context, audience and urgency.
Leadership: Can help colleagues achieve goals. Knows how to share his/her knowledge and experience.
Impact: Over-analysing or over-thinking can be as problematic as not analysing or not thinking. Ability to make decisions and take action.

Nice to Have (If you don’t have it now you will after joining)
Mastery: Ability to write code with high level of simplicity and low level of complexity.
Communication: Presents concerns, doubts or ideas publicly (speaking or writing) and with associated research (internal or external meetups, conferences).
Leadership: Give us and others constructively critical feedback in order to continuously improve.
Impact: Ability to drive change, generate knowledge and empower the team.

Shape isn’t the place for you if any of the following is true:
You want an easy, chilled-out role without much challenge
You like to be the smartest person in the room
You don’t like continuously receiving honest candid feedback
You prefer to do your own thing rather than work with a team
______________________________________________
Frequently Asked Questions

Can you tell me more about what the role is like? 
We are in scale up mode so it will be a pretty full on role with more things to do than time available. This is why it will be important to prioritise and also develop capacity in the team by hiring and holding the team to the highest standards. We don’t like to mess about so you will need to be a very high performer who only wants to work with others of your ilk.
We are growing rapidly so that means you role will grow rapidly too, you will need to keep up and constantly be looking 1-2 years ahead.

Where would I be working? 
All of our roles are 100% remote and home-based. However, if you would like to work in a co-work space to get out of the house we can arrange that. If you are in one of our locations with offices you can come as often as you like.
_____________________________________________
Salary and Benefits

Standard Stuff 
Paid Annual Leave 25 days + statutory Bank Holidays
Flexible hours
Compensation for this role depends on your capability level and will likely fall in the PHP 836,550 to 2,585,700 annual range.

The Life-Changing Stuff 
4 Day Weeks: That’s right, 4 day weeks
Grow your whole self: Our leaders are more like coaches and one of our main objectives is to give 5 years’ worth of learning and development for every 1 year with us. You have a coach, mentor, well-being therapist and a development-orientated environment: That’s literally what our vision is all about and the primary reason Shape exists
Be surrounded by the best: We only hire and retain the very best people. You might be used to being the smartest in the room but that won’t be the case in Shape. You will be surrounded by people you can learn from. We are 100% meritocratic so fast progression is the norm. You will be supported to excel in whichever areas you are most interested in! With Shape, development is unbounded
Long-term impact: We are focused on solving the biggest issues in construction project delivery in a way that can spread and outlast us
A generous equity scheme: as a fast-growing consultancy as well as the fact we are building software this has a huge upside, particularly for people that stay with us through our growth

____________________________________
Applying properly!!! Important!!! 

We get thousands of applications so please write us a letter as part of your application explaining:

Why do you want to join us?
What do you think you bring to the team?

We aren't a giant faceless corporation; we really care about the people who want to join our team so all letters will be read thoroughly.

After that, we will reach out to you to schedule a casual conversation to help you to know us a bit better and tell us a bit about yourself.

After that, we will schedule a couple of technical and personal assessments to understand what your level of capability is based on our own development matrix. This is to ensure that when you join you are starting at the right level of responsibility based on your capability not just based on experience.","Amazon Web Services (AWS)
Add,English
Add,Full-Stack Development
Add,Google Cloud Platform (GCP)
Add,Microsoft Azure
Add,React.js
Add,Ruby on Rails
Add,Software as a Service (SaaS)
Add,Terraform
Add,"
