Title,CompanyDetails,JobDetails,JobDescription,JobSkills
Security Engineer,"Manulife · Makati, National Capital Region, Philippines Reposted 1 day ago · 74 applicants",Full-time Entry level,"About the job
Are you looking for a supportive, collaborative workplace with great teams and inspiring leaders? You’ve come to the right place. We’re looking for ambitious people who share our values and want to make every day better for people around the world. If this sounds like you, and the career below sounds exciting, we’d like to hear from you.

Working Arrangement

Hybrid

Job Description

The Opportunity 

 

Are you looking for a supportive, collaborative workplace with great teams and inspiring leaders? You’ve come to the right place. We’re looking for ambitious people who share our values and want to make every day better for people around the world. If this sounds like you, and the career below sounds exciting, we’d like to hear from you.

 

At Manulife IT Delivery Center, we are looking a rock star Security Engineer, who is excited to keep our cloud applications secure while providing the best customer experience to pursue our ambition in becoming the Digital Customer Leader in the Insurance Industry.

 

We are looking for someone with: 

7+ years of similar experience
Bachelor’s degree in computer science or other highly technical, scientific discipline
Has knowledge on OWASP Top 10, Mobile Top 10 and API Top 10.
Has strong knowledge and background on using Application Security Verification Standard.
Strong understanding on vulnerabilities and knows how to give information to the developers on how to remediate the vulnerability.
Has experience on doing Vulnerability Assessment and Penetration Testing on Web Application, Mobile Application and API (REST and SOAP).
Has knowledge on Static and Dynamic Application Security Testing.
Have a commitment to build and grow your technical cybersecurity career to the next level.
Working knowledge on SAST Tools – e.g. Fortify, Checkmarx and Opensource SCA tools.
Working Knowledge on DAST Tools – e.g. OWASP ZAP, WebInspect, Netsparker, Acunetix.
Hands-on experience in security-related technologies and solutions (firewalls, IPS/IDS, WAF, SIEM, DLP, vulnerability scanner, web proxy, endpoint security, etc.)
Excellent proficiency with encryption firewalls authorization methodologies and Web filtering authentication
Profound facility with security policy development implementation and enforcement
Sound grasp of a variety of internet protocols
High skills in data analysis and network security threat identification
Strong expertise in detecting intrusions via network scans
Relevant certifications an asset: CISSP, CISA, CEH, CISM, ISSAP, ISSEP

You Will Stand Out If You Have

Experience leading high performing teams
Experience with start-ups
Strong strategic enterprise wide vision and planning skills. 
Strong understanding of policies, cross-organizational roles, and governance structures/processes. 
Strong conceptual skills; ability to deal with ambiguity; creativity; lateral thinker. 

What motivates you? 

You obsess about customers, listen, engage and act for their benefit
You think big, with curiosity to discover ways to use your agile mindset and enable business outcomes
You thrive in teams, and enjoy getting things done together
You take ownership and build solutions, focusing on what matters
You do what is right, work with integrity and speak up
You share your humanity, helping us build a diverse and inclusive work environment for everyone 

Our commitment to you 

 Our mission; to be a part of making Decisions Easier and Lives Better 
A leadership team dedicated to your growth and success 
A bold ambition and set of goals to be a leader in driving transformation in our industry
Our best. Every day. 

Every career at Manulife/John Hancock provides the opportunity to learn new skills and move your career forward. Ready to make an impact somewhere? What are you waiting for? Apply today.

About John Hancock And Manulife

John Hancock is a unit of Manulife Financial Corporation, a leading international financial services group that helps people make their decisions easier and lives better. We operate primarily as John Hancock in the United States, and Manulife globally, including Canada, Asia and Europe. We provide financial advice, insurance and wealth and asset management solutions for individuals, groups and institutions. Assets under management and administration by Manulife and its subsidiaries were CAD$1.3 trillion (US$1.1 trillion) as of June 30, 2021. Manulife Financial Corporation trades as MFC on the TSX, NYSE, and PSE, and under 945 on the SEHK. Manulife can be found at manulife.com.

One of the largest life insurers in the United States, John Hancock supports more than 10 million Americans with a broad range of financial products, including life insurance, annuities, investments, 401(k) plans, and education savings plans. Additional information about John Hancock may be found at johnhancock.com.

Manulife is an Equal Opportunity Employer

At Manulife/John Hancock, we embrace our diversity. We strive to attract, develop and retain a workforce that is as diverse as the customers we serve and to foster an inclusive work environment that embraces the strength of cultures and individuals. We are committed to fair recruitment, retention, advancement and compensation, and we administer all of our practices and programs without discrimination on the basis of race, ancestry, place of origin, colour, ethnic origin, citizenship, religion or religious beliefs, creed, sex (including pregnancy and pregnancy-related conditions), sexual orientation, genetic characteristics, veteran status, gender identity, gender expression, age, marital status, family status, disability, or any other ground protected by applicable law.

It is our priority to remove barriers to provide equal access to employment. A Human Resources representative will work with applicants who request a reasonable accommodation during the application process. All information shared during the accommodation request process will be stored and used in a manner that is consistent with applicable laws and Manulife/John Hancock policies. To request a reasonable accommodation in the application process, contact recruitment@manulife.com.","Application Security
Add,Computer Science
Add,Data Privacy
Add,Ethical Hacking
Add,Lateral Thinking
Add,Network Security
Add,Penetration Testing
Add,Vulnerability
Add,Vulnerability Assessment
Add,Vulnerability Management
Add,"
Software Developer,"Cosmotech Philippines, Inc. · Makati, National Capital Region, Philippines 2 weeks ago · 16 applicants",On-site Full-time Mid-Senior level,"About the job
Role Accountabilities:
Developing new applications leveraging knowledge of algorithms, data structures and design patterns.
Refactoring existing codebases to improve usability, performance, and efficiency.
Implementing new features in existing applications.
Writing optimized code to handle millions of requests.
Developing unit tests, documentation for features, evaluating quality and proposing corrective actions
All project development for web applications as required.
Create database tables, stored procedures, functions, triggers, etc. Plays a major role in all parts of SDLC

Qualifications, Experience, and Skills:
Minimum of three (3) years’ working experience .Net development
Exposure in web development and cloud-based solution
Proficient in C# .Net/ and/or .NET Core
Experience in developing APIs
In-depth knowledge and understanding of: MVC Framework, Object-Oriented Programming, Entity Framework, LINQ
Experience in working with different databases (e.g. MS SQL, MySQL, MongoDB)
Experience in creating SQL queries, stored procedures and triggers.
Working knowledge in JavaScript, HTML, CSS, Ajax, Bootstrap and jQuery
Working Experience with JS Frameworks (e.g., React, Angular, Vue.js)
Experience in integration with JSON and APIs
Knowledge in UI/UX design principle
Experience in working with progressive web application
Experience with version control tool (e.g., GIT, Azure DevOps)
Experience in Agile practices
Experience in automated unit testing is an advantage
Knowledge in hardware and software integration is an advantage","ASP.NET MVC
Add,C#
Add,C# in .NET
Add,MongoDB
Add,"
Engineer I - Software,Microchip Technology Inc. · Metro Manila Reposted 1 week ago · 289 applicants,On-site Full-time Entry level,"About the job
Are you looking for a unique opportunity to be a part of something great? Want to join a 20,000-member team that works on the technology that powers the world around us? Looking for an atmosphere of trust, empowerment, respect, diversity, and communication? How about an opportunity to own a piece of a multi-billion dollar (with a B!) global organization? We offer all that and more at Microchip Technology, Inc.

People come to work at Microchip because we help design the technology that runs the world. They stay because our culture supports their growth and stability. They are challenged and driven by an incredible array of products and solutions with unlimited career potential. Microchip’s nationally-recognized Leadership Passage Programs support career growth where we proudly enroll over a thousand people annually. We take pride in our commitment to employee development, values-based decision making, and strong sense of community, driven by our Vision, Mission, and 11 Guiding Values; we affectionately refer to it as the Aggregate System and it’s won us countless awards for diversity and workplace excellence.

Our company is built by dedicated team players who love to challenge the status quo; we did not achieve record revenue and over 30 years of quarterly profitability without a great team dedicated to empowering innovation. People like you.

Visit our careers page to see what exciting opportunities and company perks await!

Job Description

Software development support for the Manufacturing Execution System (FACTORYworks) based at Microchip Philippines’ facility. The candidate will participate in and/or coordinate tasks involved in Software Development Life cycle: analysis, design, development, testing, implementation, post-implementation, integration or upgrade support.
Develop quality software solutions in support of technical specifications
Perform unit testing as defined in test scripts
Participate in code reviews with development team
Participate in program prototyping (system demo) with end-users
Perform root cause analysis on program issues and suggest root cause solutions Modify and enhance existing programs as prioritized by the team
Participate and/or coordinate tasks in system analysis, design, testing, implementation and post-implementation
Write and maintain application technical documentation
Implement application configurations and support as needed.
Requirements/Qualifications
BS Degree in Computer Science, Information Technology, or any technology related course
Experience in Computer Programming (preferably .Net and/or VB.6)
Knowledge in OOP, MVC design methodology, RDBMS, SQL, web development
Familiar with any source code control
Open to new graduates or .5 to 1 year industry experience
Travel Time

0% - 25%","Computer Science
Add,Model-View-Controller (MVC)
Add,Modeling and Simulation
Add,Object-Oriented Programming (OOP)
Add,Prototyping
Add,RDBMS
Add,SQL
Add,Systems Analysis
Add,Technical Documentation
Add,Technical Specs
Add,"
Java Developer,"Samsung Electronics · Taguig, National Capital Region, Philippines 2 weeks ago · 110 applicants",Hybrid Full-time Mid-Senior level,"About the job
Disclaimer: Samsung has a strict policy on trade secrets. In applying to Samsung and progressing through the recruitment process, you must not disclose any trade secrets of your current or previous employer

Job Description:
Samsung is looking for world class Java developer to join our technology innovation group focused on the rapid development of cloud based end-to-end mobile applications and payment services. This is an exciting area for Samsung: Cloud based service platforms and infrastructure to support mobility.
Implement, maintain and evolve cloud-based products and services
Integrate with external customer and 3rd-party systems
Perform extensive research and analysis to make optimal architecture and design decisions
Write well designed, testable, efficient code
Write documentation
Interface with other groups including Product Management, QA and Operations


WORK EXPERIENCE
BS or MS in Computer Science or equivalent experience
Experience in server development using Spring Framework and Java EE in AWS
Strong skills in one or more of: Java 8/Tomcat/Java EE, Spring Boot
Hands-on understanding of scalability and high availability
At least 2 years hands-on experience with analyzing and addressing application performance bottlenecks
Strong knowledge of SQL and NoSQL databases, including MySQL, Couchbase/MongoDB
Apache, Nginx, HAProxy
Expertise in Linux (Ubuntu, CentOS)
Proficient understanding of code versioning tools, such as Git
Familiarity with build tools such as Ant, Maven, and Gradle","Apache
Add,Couchbase
Add,Git
Add,Gradle
Add,Java
Add,MySQL
Add,Nginx
Add,SQL
Add,Spring Boot
Add,Tomcat
Add,"
Mulesoft developer (Philipines or India),K2 Partnering Solutions · Philippines 3 weeks ago · 61 applicants,Remote Full-time Mid-Senior level,"About the job
We are seeking a skilled MuleSoft Developer to join our dynamic IT team. The ideal candidate should have a solid understanding of MuleSoft's Anypoint Platform, with hands-on experience in designing, developing, and implementing integration solutions.

This position can be supported remotely from Philippines or India

Responsibilities:
Design and develop MuleSoft integration solutions.
Implement APIs and integrate with third-party applications.
Configure and optimize MuleSoft connectors, flows, and transformations.
Conduct unit testing and troubleshoot integration issues.
Collaborate with cross-functional teams to gather requirements.
Ensure alignment with overall architecture and business objectives.
Document design, development, and deployment activities.
Requirements:
Proven MuleSoft development experience.
Familiarity with API design, RAML, and RESTful principles.
Hands-on experience with MuleSoft Anypoint Platform.
Knowledge of integration best practices.
Proficiency in XML and JSON.
Experience with MuleSoft CloudHub deployment.
Strong problem-solving and debugging skills.
Excellent communication and collaboration abilities.
Qualifications:
Bachelor's degree in Computer Science or related field.
MuleSoft Certified Developer certification is a plus.","Computer Science
Add,Debugging
Add,JSON
Add,MuleSoft Anypoint Platform
Add,MuleSoft CloudHub
Add,RAML
Add,Requirements Gathering
Add,Skill Development
Add,Unit Testing
Add,XML
Add,"
Senior Software Test Engineer,"Drake International Philippines · Makati, National Capital Region, Philippines 1 week ago · 41 applicants",On-site Full-time Mid-Senior level,"About the job
One of our clients, a global IT solutions company is currently looking to hire a Sr. Software Test Engineer to join their dynamic team in Makati.

Job qualifications:
At least 8 years of experience in software testing
Able to communicate well with offshore team

Experiences in the ff:
Full software development life cycle, especially in testing process and concepts
Agile scrum methodology

Experiences with:
Creating test plan and strategy
Test analysis and design
Test implementation and execution
Test monitoring and control
Maintaining test cases inventory
Defect tracking and management
Issue investigation and documentation of findings
Test process improvement
Test documentation
Manual and automation testing
Lead and train other test engineers / share knowledge with other test engineers
Experience with Functional testing:
System testing
System integration testing
Confirmation testing
Regression testing
Smoke testing
Experience with Non-functional testing:
Performance testing
User interface testing
Compatibility testing
Experience with:
Creating user stories and maintaining product backlog
Requirements gathering and analysis
Familiar with the following: Website testing, Web browser dev tools (Chrome dev tool), Database testing, Docker, Azure Repo and Pipeline, Azure wiki
Working knowledge of the following: SQL statements and scripting, Azure Data Studio, Azure DevOps (Boards, Test Plan)","Functional Testing
Add,Non-functional Testing
Add,Regression Testing
Add,Software Development
Add,Software Testing
Add,System Integration Testing
Add,Test Analysis
Add,Test Cases
Add,Testing Process
Add,User Stories
Add,"
Back End Developer,Staffing Ninja · Philippines 6 days ago · 26 applicants,Remote Full-time Mid-Senior level,"About the job
Job Responsibilities:
Create and build scalable, high-performance backend systems supporting enterprise operations.
Craft clean, maintainable, and efficient code that aligns with best practices and coding standards.
Collaborate with diverse teams, including frontend developers, product managers, and data stewards, to comprehend requirements and devise solutions meeting business objectives.
Uphold backend systems' security, reliability, and availability through implementing measures like data encryption, load balancing, and disaster recovery.
Address and resolve issues occurring in production environments, implementing necessary fixes and enhancements.
Document backend systems and procedures, offering technical guidance and assistance to team members.
Engage in code reviews, testing, and deployment procedures to ensure backend systems' quality and stability.

 Qualifications:
Bachelor’s degree in Information Technology, Computer Science, or related field.
Minimum 3 years' experience in software development.
Proficiency in programming languages like Javascript and Python.
Experience with the Spring Framework is advantageous.
Capability to review solution designs and conduct code reviews.
Ensuring adherence to IT security standards, policies, and procedures.
Familiarity with the Agile development framework.
Good to have : Proficiency in - Japanese, Chinese and English in any of the combinations","Back-End Web Development
Add,JavaScript
Add,Python (Programming Language)
Add,Software Development
Add,Software Development Life Cycle (SDLC)
Add,Spring Framework
Add,"
