Title,CompanyDetails,JobDetails,JobDescription,JobSkills
Sr Statistical Programmer,"Dexcom · Manila, National Capital Region, Philippines 2 weeks ago · 2 applicants",On-site Full-time,"About the job
About Dexcom

Founded in 1999, Dexcom, Inc. (NASDAQ: DXCM), develops and markets Continuous Glucose Monitoring (CGM) systems for ambulatory use by people with diabetes and by healthcare providers for the treatment of people with diabetes. The company is the leader in transforming diabetes care and management by providing CGM technology to help patients and healthcare professionals better manage diabetes. Since the company’s inception, Dexcom has focused on better outcomes for patients, caregivers, and clinicians by delivering solutions that are best in class - while empowering the community to take control of diabetes. Dexcom reported full-year 2022 revenues of $2.9B, a growth of 18% over 2021. Headquartered in San Diego, California, with additional offices in the Americas, Europe, and Asia Pacific, the company employs over 8,000 people worldwide.

About Dexcom:

Dexcom, Inc. empowers people to take control of diabetes through innovative continuous glucose monitoring (CGM) systems. Headquartered in San Diego, California, Dexcom

has emerged as a leader of diabetes care technology. By listening to the needs of users, caregivers, and providers, Dexcom simplifies and improves diabetes management around

the world.

Summary:

Performs the design, development, modification and evaluation of technical infrastructure to expedite conduct and evaluation of clinical trials and basic research. Performs

statistical analysis and develops tracking systems to determine the efficiency of clinical trials. Evaluates databases and statistical analysis programs and interacts with computer

groups to determine hardware/software compatibility. Maintains expertise in state-of-the-art data manipulation and statistical analyses.

Essential Duties And Responsibilities:

The incumbent will generate statistical programming for all clinical trials, including but not limited to data validations, statistical analysis, and report generation (to create
tables, figures and listings).
Oversee programming activities by external vendors
Provide input in developing CRF, database, data validation plan, and specifications of analysis datasets
Review eCRF (EDC sytem) annotations and data specifications to provide input to Data Management Team for analysis needs
Check for consistency and adequacy of eCRF and database (EDC System) for analysis needs
Provide support to Data Management Team with their data validation plan or data management plan in later stages of product development or post-market studies
Write or review analysis programs as specified in the protocol or the Statistical Analysis Plan (SAP)
Write or modify efficient design and code SAS programs using BASE/SAS, SAS/STAT, SAS/GRAPH, SAS/ETS, SAS/IML, and SAS MACROS
Establish and monitor of data transfer specifications across different data environment for ongoing trials to identify study conduct or data quality issues
Review or author statistical programming related Standard Operating Procedures or Working Instructions.
Participate in operations meetings, address issues and represent the biostatistics team at meetings with cross-functional teams, contract organizations, and regulatory
agencies, when necessary
Assumes and performs other duties as assigned.

Required Qualifications:

At least 5 years of experience in statistical programming in clinical environments and biomedical industry is required.
A working knowledge of templates utilities, such as SQL, and SAS, such as SAS advance, SAS macro, and SAS SQL are required. Data conversion knowledge and skills
to/from various data format, such as xml, csv, excel and SAS, are required.
Knowledge in R, Python, MatLab, or any other computer language skill is highly valued. Must be able to work with minimal oversight and work as a member of a project
team.

Experience And Education Requirements:

Typically requires a Bachelor’s degree in a technical discipline, and a minimum of 5-8 years related experience or Master’s degree and 2-5 years equivalent industry experience or a PhD and 0-2 years experience.

To all Staffing and Recruiting Agencies: Our Careers Site is only for individuals seeking a job at Dexcom. Only authorized staffing and recruiting agencies may use this site or to submit profiles, applications or resumes on specific requisitions. Dexcom does not accept unsolicited resumes or applications from agencies. Please do not forward resumes to the Talent Acquisition team, Dexcom employees or any other company location. Dexcom is not responsible for any fees related to unsolicited resumes/applications.","Clinical Trials
Add,Computerized System Validation (CSV)
Add,Data Conversion
Add,Data Manipulation
Add,Data Validation
Add,Macros
Add,SAS (Software)
Add,Statistical Analysis
Add,Statistical Programming
Add,eCRF
Add,"
Business Intelligence Developer,"Asia Peopleworks Inc · Mandaluyong, National Capital Region, Philippines 1 week ago · 10 applicants",Hybrid Full-time Mid-Senior level,"About the job
Works as an individual or as part of a team in identifying business intelligence, reporting and data analysis (advanced analytics/statistical analysis) needs of the client. Designs data models for medium-to-large applications in full or in part as assigned. Takes charge in the preparation of the data model and ETL requirements and design. Develops corporate and adhoc reports.
Ensures that the assigned data models and/or components (data mart and data stores/warehouse and Bi application) are designed to meet customer needs. Provides data that is accurate, reliable, and ensures that the information is easily available to the client for direct consumption, or integration with other systems.
 Ensures that the system is accurately coded and tested in accordance with requirements and design documents; and fully documented in accordance with the company’s standards and methods. Provides documentation that is clear and easy to understand.
 Works with ITD technical support staff to ensure assigned systems are properly operated and maintained.
 Regularly submits reports on progress status including problems encountered and resource requirements of assigned application systems
 
Requirements:
 
At least 5 years' experience in modeling data, ETL analysis and design, including comprehensive experience in SQL programming.
 Proficiency in SQL programming, Oracle RDBMS, creating data models using Cognos Framework Manager, creating ETL scripts and jobs using Cognos Data Manager or similar BI tool; creating reports and analytics using Cognos Report/Analysis/Query/Metric Studios or similar BI tool.
 Proficiency in SQL performance analysis and tuning.
 Excellent ability in systems analysis and design, and in the preparation of functional and detailed specifications documents.
 Extensive knowledge in analysis, design, development and impementation of BI systems using standards- and best practices-based methodologies and frameworks and in the use of associated roductivity tools.
 **Location - Mandaluyong
**Hybrid work set-up
**Dayshift","Business Intelligence Tools
Add,Cognos ReportNet
Add,ETL Tools
Add,Extract, Transform, Load (ETL)
Add,IBM Cognos Analytics
Add,Microsoft SQL Server
Add,Oracle Database
Add,SQL
Add,"
Site Reliability Engineer,"Broadridge · Manila, National Capital Region, Philippines Reposted 1 week ago · 14 applicants",Hybrid Full-time,"About the job
At Broadridge, we've built a culture where the highest goal is to empower others to accomplish more. If you’re passionate about developing your career, while helping others along the way, come join the Broadridge team.

At Broadridge, we've built a culture where the highest goal is to empower others to accomplish more. If you’re passionate about developing your career, while helping others along the way, come join the Broadridge team.

Part of a global team of production experts working in a “Follow the Sun” support model, we’re now looking for a Site Reliability Engineer to join us in Manila. The team ensures smooth operations of the Client’s hosted platforms, guaranteeing the availability, security, integrity, and performance of all systems (24/7). Involved at the very beginning of client projects, the Site Reliability Engineer provides technical expertise and guidance to make sure the proposed solution is fully aligned with production standards and best practices. If you have solid experience in production and enjoy fast-paced environments,

Must be willing and open to work in a compressed work schedule as needed, such as 40-hour for 4 days or similar schedule. we’d love to get in touch with you!

Main Responsibilities

Platform Monitoring, Incident management & Level 2 Support

Management of daily operations of client’s hosted platforms, proactive monitoring of Global Systems
Participation in production shift duties to cover APAC, EMEA, and Americas regions
Incident coordination/crisis response & stakeholder communication
Timely resolution of incidents & escalation, preparation of post-mortem, tracking & follow up
Regular review of system’s capacity and performance, initiate upgrades/maintenance as required
Produce daily health checks and customer status reports
Leverage data analytics to anticipate trends and potential challenges

Implementation & Change Management

As a gatekeeper, owns the change control process with clients, partners, and internal teams
Review and deploy customer platforms with the assistance of SRE technical experts
Assess, schedule, and deploy platform enhancements/upgrades and new business features
Improve and automate production tools/scripts (monitoring, failover, checks, backup/recovery…)

Project & Engineering

Manage technical projects (production tools enhancements: monitoring, scripting, deployment tools...)
Run proof of concepts and validate new technical solutions (high availability mechanism, CI/CD pipeline...)
Participate in global efforts to roll out large-scale platforms (client onboarding, low latency solutions, Cloud...)

Skills And Qualifications

Degree in computer science, software engineering, or a related field
Minimum 3 years of experience as “Application Support Engineer” in the financial industry
Excellent analytical / troubleshooting skills with a strong production-oriented mindset
Good general IT knowledge (OS Linux, networking, systems/database, messaging, Cloud...)
Proficient with one or more scripting/programming languages: Perl, Python, Java, Shell...
Knowledge of Agile/DevOps practices, automation tools (Ansible), and CI/CD pipeline
Strong experience with monitoring platforms (Nagios, ITRS...)
Available and willing to go the extra mile (weekend / public holiday operations, Production shifts...)
Familiar with ITIL framework & service management best practices
Must be willing and open to work in a compressed work schedule as needed, such as 40-hour for 4 days or similar schedule. 

Expected Behavior

Committed, self-motivated, and fast learner
Strong team spirit with excellent communication
Proactive, independent, and proven ability to work under pressure
Fluency in English essential

Broadridge associates helped us envision our Connected Workplace, a work model that allows associates around the globe to take advantage of the benefits of both on-site and off-site work to support our clients, one another, and the communities where we live and work. Our Connected Workplace is grounded in the concept of FACS: Flexible, Accountable, Connected, and Supported, which is our commitment to our associates. FACS supports our strong culture and allows us to achieve business goals while supporting meaningful work-life integration for our associates.

We are dedicated to fostering a diverse, equitable, and inclusive environment and committed to providing a workplace that empowers associates to be authentic and bring their best to work. We believe that associates can only do their best when they feel safe, understood, and valued, and we work diligently and collaboratively to ensure Broadridge is a company—and ultimately a community—that recognizes and celebrates diversity in all its dimensions.","Automation
Add,Communication
Add,Computer Science
Add,Proactive Monitoring
Add,Reliability
Add,Site Reliability Engineering
Add,Software Development
Add,Stakeholder Relations
Add,Troubleshooting
Add,"
"Senior Mobile Engineer, gt.school (Remote) - $100,000/year USD","Crossover  · National Capital Region, Philippines Reposted 6 days ago · 6 applicants",Remote Full-time Mid-Senior level,"About the job
Crossover is the world's #1 source of full-time remote jobs. Our clients offer top-tier pay for top-tier talent. We're recruiting this role for our client, gt.school. Have you got what it takes?

Are you passionate about creating high-quality applications that truly matter? We’re looking for someone who values clean, modular code, aligns with our emphasis on high-quality work, and is eager to take ownership of a product that is pivotal to our vision. If shaping the next generation of grade school education sounds exciting, this opportunity might be perfect for you.

At gt. school, our focus isn’t just on creating another app; we're pioneering an innovative approach to learning by integrating modern techniques like advanced AI, adaptive computer-based training, gamification, and continuous feedback. At the heart of it all, our app draws inspiration from popular platforms like TikTok, allowing learners to have an immersive feed experience, making education interactive, engaging, and truly enjoyable.

This role demands ownership and independence; we believe that restricting oneself to front-end or back-end is counterproductive. Here, we advocate for full-spectrum development. If a tweak in the API or a backend validation is needed, we trust you'll handle it. Your decisions will significantly shape the product and ensure a seamless and intuitive experience for our users.

Your responsibilities will include transforming UI designs into functional app features, investigating and fixing bugs, and collaborating with our product and backend teams to ensure consistent functionality. While the fast-paced environment is challenging, the reward in terms of both personal growth and the tangible impact on students is immense.

If this resonates with you, and you're up for the challenge of making a significant difference in the EdTech space, we would love to hear from you!

What You Will Be Doing

Taking high-fidelity UI designs and transforming them into interactive and efficient mobile app features
Integrating screens with our modern GraphQL APIs, ensuring data consistency and responsiveness
Participating in both automated and manual reviews to maintain our standards for clean, modular code
Collaborating with product managers and UX designers to ensure the functionality, reliability, and user-friendliness of the app

What You Won’t Be Doing

Building components from scratch - you'll leverage existing high-quality solutions for efficiency
Getting stuck in endless approval loops - we value swift decision-making and autonomy
Isolated tasks - you will collaborate closely with a supportive product and backend team

Senior Mobile Engineer Key Responsibilities

Delivering a high-quality application that serves as the primary interface for students in our cutting-edge computer-based learning environment

Basic Requirements

At least 5 years of experience developing mobile applications
At least 2 years in a leadership role, making technical design decisions for mobile applications
Experience using React Native for cross-platform app development

About Gt.school

GT School is an EdTech Startup that leverages technology, AI, and subject matter experts to cultivate a new way of learning. Our unique approach leverages 50+ years of learning science, cutting-edge data analytics and high-performance coaching. In doing so, we can help students learn more, learn faster, and learn better - and have fun while doing it. We are a remote-first company that hires globally via Crossover.

There is so much to cover for this exciting role, and space here is limited. Hit the Apply button if you found this interesting and want to learn more. We look forward to meeting you!

Working with Crossover

This is a full-time (40 hours per week), long-term position. The position is immediately available and requires entering into an independent contractor agreement with Crossover. The compensation level for this role is $50 USD/hour, which equates to $100,000 USD/year assuming 40 hours per week and 50 weeks per year. The payment period is weekly. Consult www.crossover.com/help-and-faqs for more details on this topic.

What to expect next:

You will receive an email with a link to start your self-paced, online job application.
Our hiring platform will guide you through a series of online “screening” assessments to check for basic job fit, job-related skills, and finally a few real-world job-specific assignments.

Important! If you do not receive an email from us:

First, emails may take up to 15 minutes to send, refresh and check again.
Second, check your spam and junk folders for an email from Crossover.com, mark as “Not Spam” since you will receive other emails as well.
Third, we will send to whatever email account you indicated on the Apply form - by default, that is the email address you use as your LinkedIn username and it might be different than the one you have already checked.
If all else fails, just reset your password by visiting https://www.crossover.com/auth/password-recovery if you already applied using LinkedIn EasyApply.

Crossover Job Code: LJ-4581-PH-NCRNatio-SeniorMobileEn.025","Android Development
Add,Application Programming Interfaces (API)
Add,Mobile Application Development
Add,Mobile Applications
Add,React Native
Add,Responsiveness
Add,Swift (Programming Language)
Add,Technical Design
Add,User Interface Design
Add,iOS Development
Add,"
Web Developer,"Newfold Digital · Cebu, Central Visayas, Philippines 2 weeks ago · 81 applicants",Hybrid Full-time Entry level,"About the job
Who We Are.

Newfold Digital is a leading web technology company serving millions of customers globally. Our customers know us through our robust portfolio of brands. We have some of the industry's most prominent and storied go-to-market brands, including Bluehost, HostGator, Domain.com, Network Solutions, Register.com and Web.com. We help customers of all sizes build a digital presence that delivers results. With our extensive product offerings and personalized support, we take pride in collaborating with our customers to serve their online presence needs. The strength of our company lives in the intersection of our people, our customers, and our brands.

The Web Developer will create website using the WordPress platform serving APAC region.

What you’ll do & how you’ll make your mark

Participates in the project walk through with the Project Coordinator and Web Designer to discuss the scope and timeline
Collaborates in meetings to discuss project ideas, website functionalities, and code reviews
Develops projects based on the agreed final project goal
Coordinates with the Project Coordinator for any queries or clarifications regarding project details
Coordinates with the Team Leader on any technical challenges on the project handled
Conducts website testing to ensure that the web functionalities work and are compliant to our website standards
Submits the output to the Quality Control Team for the assessment on the web standards and site functionalities
Fixes bugs and implements possible solutions for the quality control kickbacks
Executes revisions based on the feedback of the client
Complies with the requirements prior to a website going live after getting the client’s approval
Sends the website documentation to the Project Coordinator assigned to the project
Updates the status of the project management tool based on the progress work
Researches new technologies that are required to improve and deliver high performing websites to our customers
Takes responsibility and ownership on projects assigned from the beginning till end of the development cycle
Ensures that the website developed is delivered timely and exceeds customer’s expectations and/or included all requested requirements
Collaborates in team meetings as required to discuss project ideas and during code reviews
Follows best coding practices, complies with the QC’s Website Standards, and observe processes implemented in the department
Develops and maintains special projects relating to custom solutions


Who you are & what you’ll need to succeed.

Must have at least 1 year experience as Web Developer
Must have working knowledge in HTML5, CCS3, MySQL, PHP
Preferably with experience in any CMS template, plugin and custom feature creation
Preferably familiar with WordPress, Wordpress codex, Wordpress rest, API/Filters/Hooks and eCommerce development
Preferably with experience in Git/GitHub/GitLab, Git Visualization tools
Preferably with experience in other CMS frameworks, CSS Frameworks, JS Frameworks, Task Runners/Module Bundlers


Why you’ll love us.

Work-life balance. Our work is thrilling and meaningful, but we know balance is key to living well.
We celebrate one another’s differences. We’re proud of our culture of diversity and inclusion. We foster a culture of belonging. Our company and customers benefit when employees bring their authentic selves to work. We have programs that bring us together on important issues and provide learning and development opportunities for all employees. We have 20 + affinity groups where you can network and connect with Newfolders globally.
We care about you. We are a family, and we care about you and your family’s physical and mental health by providing competitive HMO benefits – 175k MBL with one free dependent upon one year of service! We also give out Punctuality Bonus, Generous Vacation policy, and much more!
Where can we take you? We’re fans of helping our employees learn different aspects of the business, be challenged with new tasks, be mentored, and grow their careers. Unfold new possibilities with #teamnewfold!
Must have at least 1 year experience as Web Developer
Must have working knowledge in HTML5, CCS3, MySQL, PHP
Preferably with experience in any CMS template, plugin and custom feature creation
Preferably familiar with WordPress, Wordpress codex, Wordpress rest, API/Filters/Hooks and eCommerce development
Preferably with experience in Git/GitHub/GitLab, Git Visualization tools
Preferably with experience in other CMS frameworks, CSS Frameworks, JS Frameworks, Task Runners/Module Bundlers


This Job Description includes the essential job functions required to perform the job described above, as well as additional duties and responsibilities. This Job Description is not an exhaustive list of all functions that the employee performing this job may be required to perform. The Company reserves the right to revise the Job Description at any time, and to require the employee to perform functions in addition to those listed above.","Code Review
Add,Doctrine (PHP)
Add,HTML5
Add,MySQL
Add,PHP
Add,SQL
Add,Web Design
Add,Web Development
Add,Web Standards
Add,Web Testing
Add,"
