Title,CompanyDetails,JobDetails,JobDescription,JobSkills
SYSTEMS AND DATABASE SENIOR ENGINEER,"Zuellig Pharma · National Capital Region, Philippines 6 days ago · 13 applicants",Hybrid Full-time Associate,"About the job
The Supervisor, Systems Administration is responsible for ensuring the continuous running of Zuellig Pharma System, Non-Sap Applications management and monitoring of Linux and windows Servers. Oracle, Microsoft SQL, MySQL, Postgres, any kind of Database environments - design, implementation and maintenance of complex database systems including data modeling, access, security, performance optimization, backup recovery, and documentation. The role is also in-charge of the management of Non-SAP Systems, IT Infrastructure. 

DUTIES AND RESPONSIBILITIES:
Ensures full documentation of Existing Non-SAP Systems in place
Trains other systems administrators in the group
Completions of systems administration tasks for ISG projects
Ensures high availability, reliability and acceptable performance of all production applications;
Ensures high availability and acceptable levels of performance of
Coordinates between Development groups and other ISG Operations groups
Performs coordination with Change Management, Project Management, Incident Management etc.
Supports related development and process improvements in ISG Operations
Escalation point.
Participates and develop monitoring policies, procedures, standards and tools relating to database/servers management including backups and disaster recovery
Participates in managing a diverse workload
Accountable for managed systems.
Minimal Supervision.
Perform other duties as assigned.

WORK EXPERIENCE
8 years of relevant technical experience.
Extensive Experience authoring database queries and stored procedures
Extensive Experience in a remote support environment is a plus
Extensive Experience with Linux and Windows Server environments
Extensive experience with database technologies (MySQL, MS SQL, PostgreSQL Oracle, MongoDB, etc
Experience with cloud services (AWS, Microsoft Azure) a plus

EDUCATIONAL LEVEL:
Bachelor's degree in MIS / Business / IT or a similar subject with strong exposure to information technology.
Certified Database Administrator is a plus.

KNOWLEDGE SKILLS AND ABILITIES:
Install and maintain the performance of database servers.
Develop processes for optimizing database security.
Set and maintain database standards.
Manage database access.
Authoring database queries and stored procedures
Performance tuning of database systems.
Install, upgrade, and manage database applications.
Backup and Restore procedure plan and execution.
Diagnose and troubleshoot database errors.
Recommend and implement emerging database technologies.
Create and manage database reports, visualizations, and dashboards.
Create automation for repeating database tasks.
Be available for on-call support as needed.
· Working knowledge in Unix/Linux operating systems environment, experience in Windows is a plus
· Knowledge of network architecture, configuration management is appreciated
Good analytical skills; able to implement a structured and methodical approach in processes and problem solving.
Ability to identify the work required and organize, facilitate and / or perform the work with only minimal guidance from senior
Experience in Microsoft BizTalk is a plus
Experience in a remote support environment is a plus
Capable to initiate, coordinate and drive issue resolution.
Strong communication skills with internal/external customers and various audiences.
Exceptional organizational and analytical skills;
Administering Linux servers including performance tuning, monitoring, scripting, version upgrades, and assist on projects. 
Administering Linux Network File System (NFS) and supporting web servers. 
Work with application teams providing support on issues and OS upgrades.
Provide daily support for issues, backup and recovery, data storage, system access and security.
Ensure proper OS licensing and support is in place and maintain version management for all servers.
Assist in company’s Disaster Recovery planning and testing and audit processes.
Act as the platform expert for Linux and advisor for colleagues utilizing and integrating client-server tools and be willing to educate and teach others team members
Solve complex technical problems, plan and execute projects, prioritize tasks, conduct research, and work independently under constraints of time and resources.
Excellent written and communication skills and be a Team player.
Scripting is a must (Powershell, VBscript, Shell script etc)
Integrate new system as needed.
Work with Architects and lead developers to come up with optimal database design

TECHNICAL COMPETENCIES:
Shows proficiency in the following:
Server Management Windows and Linux
Database Management, Oracle and Microsoft SQL environments
Troubleshooting
Ticket Resolution","Amazon Web Services (AWS)
Add,Linux
Add,Microsoft Azure
Add,Microsoft SQL Server
Add,MongoDB
Add,MySQL
Add,Oracle Database
Add,PostgreSQL
Add,SQL
Add,Windows Server
Add,"
Software Application Engineer (VB.Net and MS SQL),"Markem-Imaje · Makati, National Capital Region, Philippines Reposted 1 week ago · 130 applicants",Hybrid Full-time Associate,"About the job
Markem-Imaje is a trusted world manufacturer of product identification and traceability solutions, offering a full line of reliable and innovative inkjet, thermal transfer, laser, print and apply label systems.

Markem-Imaje delivers fully integrated solutions that enable product quality and safety, regulatory and retailer compliance, better product recalls and improved manufacturing processes.

Our connected solutions help manufacturers to reduce waste, increase efficiency, achieve compliance, and protect their brand.


We offer the most complete range of market-leading marking and coding systems along with software, services, and consumable solutions so you can streamline all your printing needs from one supplier.


The role:
Software Application Engineer designs and configures solutions based on customer specific requirements and agreed specifications, performs testing of the configured solution, technical documentations, and installations until completion of the customer agreed solution.
 
What you will do:
Responsible in reviewing final Solution Proposal Document and converts it into a Software Application Design Specification that contains complete software functionalities, project deliverables and acceptance criteria.
Execution of solution engineering process and its activities. Ensure that software application configuration is according to the agreed project plans, budget and meets customer expectations.
Utilize the Pre-configured Solution Template as the base for software application configuration and configure it according to the approved Software Application Design Specification.
Responsible for performing in-house testing of the configured software application; escalating any out-of-scope functionality requested by customer to immediate manager for approval.
Responsible for configured software application, performs SAT, End User Trainings and supports Go Live.
Support and resolve software related issues encountered during testing, installation and commissioning (SAT).
Responsible for Project handover to Global Helpdesk team.


What you need to have: 
Bachelor’s degree in computer science, Information Technology, Computer Engineering, or equivalent
At least 3 years of exposure in software development lifecycle and project delivery methodology possessing the technical competencies as follows:
- Configuration of PC-based software solutions, able to test, install and validate performance against project deliverables
- Various .NET programming languages, expertise on VB.NET.
- Proven experience on Relational Databases (MS SQL), use of SQL Reporting service
Prior documentation skill is a MUST.
Excellent interpersonal, verbal, written communication skills and able to interact with diverse, cross-cultural stakeholders.
Basic understanding of IT / networking and aptitude for quickly learning new software tools and hardware
Ability to work in a multi-tasked environment.
Knowledgeable in manufacturing and supply chain automation is a plus.


The position involves approximately 10% - 25% of travel, on average, and includes domestic and international travel. This involves traveling to customer sites, possibly involving air travel.

 You’ll only be the right candidate if you are aligned to our values and culture: 
Collaborative entrepreneurial spirit
Winning through customers
High ethical standards, openness and trust
Expectations for results
Respect and value people


If you believe you match our values and have the experience we’re looking for, then apply! We can’t wait to hear from you.",".NET Framework
Add,Computer Science
Add,Databases
Add,English
Add,Microsoft SQL Server
Add,Relational Databases
Add,SQL
Add,Software Development Life Cycle (SDLC)
Add,Software Documentation
Add,Visual Basic .NET (VB.NET)
Add,"
Systems Engineer II - Exchange,"Atos · Pasay, National Capital Region, Philippines Reposted 2 weeks ago · 45 applicants",On-site Full-time,"About the job
Role Exchange Engineer

Job Summary

Microsoft Exchange Analyst provides operational support for Windows Exchange Servers and Office365 tenants that deliver services for the organization’s environment. Support the process of vulnerability management to ensure a secure and stable environment. Participate in operational ticket management including helping end users, completing requests, and changes. The position requires a responsible, self-motivated, well-organized individual with the ability to handle multiple concurrent projects while adapting quickly to rapidly changing priorities.

Responsibilities And Duties

Work closely with vendors to resolve user and production issues.
Participate in operational support and on-call for a large enterprise messaging environment
Troubleshoot Exchange on-premise servers and M365 messaging resources
Generate operational documentation including change management paperwork
Maintain high morale to go above and beyond the minimum requirements
Work on multiple operational issues at one time
Provide support for ancillary messaging products including mobile management, faxing solution, and distribution list tools Perform other related duties as assigned
Provide support for release deployments in a 24x7 operations environment as required
Produce technical and operational documentation


Qualifications

2+ years of experience managing the day-to-day administration, support, maintenance, and monitoring of Exchange and Office365 Experience with mail routing
Must be able to communicate technical concepts clearly to a wide audience
Demonstrate a customer focused attitude.
1+ Service Now or equivalent ticketing system experience
Must be able to communicate technical concepts clearly to a wide audience
Microsoft Active Directory
Administration experience
PowerShell scripting experience
ITIL experience (preferred)
Ability to work in a 24x7 on-call after hour rotation environment
Good understanding of change management
Required Soft Skills Excellent communication and interpersonal skills Strong problem-solving and analytical skills
Ability to work independently and as part of a team Willingness to learn and adapt to new technologies Attention to detail and commitment to accuracy","Analytical Skills
Add,Communication
Add,Interpersonal Skills
Add,Microsoft Exchange
Add,Morale
Add,Problem Solving
Add,Scripting
Add,Soft Skills
Add,System Administration
Add,Systems Engineering
Add,"
Global Infrastructure Operations Engineer,"Arcadis · Makati, National Capital Region, Philippines 1 week ago · 24 applicants",Hybrid Full-time Mid-Senior level,"About the job
Arcadis is the world's leading company delivering sustainable design, engineering, and consultancy solutions for natural and built assets. We are more than 36,000 people, in over 70 countries, dedicated to improving quality of life. Everyone has an important role to play. With the power of many curious minds, together we can solve the world’s most complex challenges and deliver more impact together.

Role Description:
Responsible for the day-to-day operations on 24x7 environment of Arcadis infrastructure playing the role of a level 2 support engineer. The Global Infrastructure Operations Engineer is responsible for working on all in a timely manner and can escalate to next level of support when the problem has been identified to be of complex nature that requires elevated/complex skills. They are also responsible to adhere to the SLT on the incidents and changes and ensure that collaborative efforts are placed when incidents cross service lines.

Role Accountabilities:

Individual Accountabilities
Responsible for upholding response and resolution targets on incidents pertaining to Servers and Storage
Understand and align service rendered in accordance with service level targets agreed with each of our multiple stakeholders.
Responsible for managing the team, partners, and vendors accountable to the SLAs/KPI and internal processes. Delivering on these metrics is key to the role.
Coordinating the required teams to complete the problem management process in relation with Connectivity.
Accountable in the implementation of change process, making sure each change is compliant to the approved parameters stated/discussed during CAB
In tight collaboration with internal teams, partners, and vendors, making sure each revisions/change that will be introduced into the live environment have been tested vigorously and will have minimal effect to live service.
You are expected to use CMDB to track and document versioning of server/storage assets. making sure we can go from one version of the config to another at a moment's notice.
Adhering to the service level definition and ensuring that our partners also deliver to these levels.
Delivering on the required SLA/KPI’s specifically for Servers and Storage regarding monitoring (reacting to alerts, reactively and proactively) and ensuring that the systems availability is crucial. Review of capacity regarding links and compute and storage values is also a key requirement.

Qualifications & Experience:
Minimum 4+ years’ w/in Tech industry, with at least 2-year experience in a similar role.
Demonstrated experience in managing Windows and Linux based Servers.
2+ years’ experience managing and deploying physical and virtual servers.
Knowledge and background on CLI and PowerShell.
Experience in SCCM/MECM.
Experience in Azure Update Management Center is a plus. 
Working knowledge in operational tasks involving Active Directory, domain administration, group policy and data file sharing.
Experience in use ITSM/ITOM tooling like BMC Helix and/or service now.
Experience in doing proactive engineering actions by use of an SIEM tooling (Logicmonitor, Solarwinds, Alienvault).
In depth understanding of monitoring and event management practices that includes alert handling, analysis, and diagnosis to resolution.
ITIL, standards and process frameworks (Support Operations and Management)
Problem management, Triaging methodology, Governance, principles, and policies.
Support framework and governance knowledge.
Registrations/Skills/Certifications related to the following technologies:
Cloud Infrastructure (Azure)
Virtualization tools (VMWare, Hyper-V)
Data storage (NetApp, HP Master ASE)","Active Directory
Add,Domain Name System (DNS)
Add,Group Policy
Add,Hyper-V
Add,ITIL
Add,Linux
Add,Microsoft Endpoint Configuration Manager
Add,NetApp
Add,Powershell
Add,VMware
Add,"
Software Engineer (Config),"Eclaro · Quezon City, National Capital Region, Philippines Reposted 1 day ago · 8 applicants",On-site Full-time Entry level,"About the job
Analytics Deployment Engineer

Job Tasks/ Responsibilities

Deploy all technical components of batch, real time, and automation analytics projects
Coordinate Azure resource creation with IT
Document and maintain technical deployment processes and runbooks
Maintain record of all deployments, monitor processes post deployment, and coordinate communication of any issues
Review SSMR (output of all production processes) and alert team of any issues
Collaborate with implementation engineering team for releases and CI/CD pipeline maintenance
Collaborate with both US and UK implementation leads and project leads

Required Skills/ Experiences

5+ years of experience with software deployment
3+ years of application support experience
1+ years of experience with Azure Functions
1+ years of experience with Azure Portal and Resources
1+ years of experience with GitHub
Ability to clearly communicate across multiple teams, and the ability to communicate and escalate major issues when appropriate

Education

 BS in Computer Science, Information Technology degree, Data Analytics or equivalent","Application Support
Add,Azure Functions
Add,Communication
Add,Computer Engineering
Add,Computer Science
Add,GitHub
Add,Microsoft Azure
Add,Portals
Add,Software Deployment
Add,Software Development
Add,"
Senior Software Engineer,"Zoomo · Manila, National Capital Region, Philippines Reposted 5 days ago · 31 applicants",Hybrid Full-time Mid-Senior level,"About the job
Description

At Zoomo, our vision is to transition every urban mile to Light Electric Vehicles (LEVs). Zoomo offers the world’s leading platform for commercial use e-bikes. We offer customers a modular solution including fleet management software, servicing and financing. We operate across the USA, UK, Europe, Canada and Australia. In 4 years Zoomo has helped transition millions of urban miles to light electric vehicles, built a team of >200 world class engineers, operators, sales staff and vehicle repair technicians; developed and deployed the world's best last mile delivery electric bikes and fleet management software; and successfully sold these fleet solutions into the world's leading logistics businesses.

Zoomo vehicles are used by major players in the food, grocery and parcel delivery segments with partners including UberEats, Doordash, JustEat Takeaway, Deliveroo, Domino’s, Pizza Hut, Amazon, FedEx, Getir, Ocado, GoPuff and many more.

What We’re Looking For

Zoomo is looking for a Senior Software Engineer to be an integral part of our Fleet squad. This team at Zoomo is building the next generation fleet management system for light electric vehicles (LEVs). The fleet management application comprises several components: a primary web app and several companion native apps for iOS and Android devices.

You will be responsible for building tools from the ground up globally. Your work will have a large impact - it is the backbone of our business and will be used to solve problems for both our business and our customers in Europe, the Americas and Australia.

You’ll deliver business value by owning the complete software development lifecycle from inception to delivery and its post-release support. You will be responsible for maintaining coding quality, design and implementation of new and agreed architectures using best standards and modern architectures. You will be a mentor to other engineers and participate in forums within the wider team to share knowledge, experience, best practices and collaboratively raise the standard of engineering.

You will be working primarily on a backend stack, however there is room to flex your frontend muscles as well. Some of the things you will be expected to do day-to-day include:

Collaborating with other engineers and team members to help deliver Zoomo’s technical vision, strategy and roadmap. 
Independently scoping, designing, implementing and releasing significant new features and functionality that have a high impact on our customers. 
Contributing to the discovery stage by assisting engineering, product and design teams to validate assumptions. 
Engaging in software architecture discussions to help evolve Zoomo’s software platform to meet the growing global expansions. 
Working with managers and engineers to help define high standards for code, deployments and documentation. 
Coaching other engineers in their technical progression. 
Participating in technical knowledge sharing sessions to promote best practices and the latest technology trends

Requirements

7+ years of experience building, shipping and maintaining highly scalable web applications
Fluency in Typescript and at least one other statically typed language
Experience writing unit and integration tests (preferably using Jest)
Strong knowledge of architectural designs and best practices
Experience building and documenting REST APIs
Experience deploying applications in the cloud (preferably using GCP)
Experience with deployment pipelines (eg. GitHub Actions, Cloud Build)
Experience with infrastructure as code (namely Terraform)

What Will Set You Apart

Transport or LEV industry experience
Experience with or a desire to learn frontend frameworks (especially React)
Demonstrated experience working in a fast paced startup environment

OUR IDEAL CANDIDATE

You are a team player with excellent communication skills and experience working in a distributed environment
You thrive on analysing problems, formulating solutions, and making those a reality. 
You have a passion for quality and know what best-in-class engineering looks like; you build for the long term. 
You love working in a fast-paced startup environment where experimentation, learning and iteration are highly valued and encouraged. 

Benefits

We offer you the chance to be part of a team at the cutting edge of the world’s electrification journey, including:

Working with a switched on team that strives to make the streets greener and serve the rider
A competitive salary
Global and country-specific benefits packages
Flexible working that is focussed on the delivery of OKRs
Annual learning and development allowance
Mental wellbeing support

Zoomers currently represent 45 nationalities and we celebrate diversity and inclusion with equal opportunities for all.","Analytical Skills
Add,Back-End Web Development
Add,Communication
Add,Documentation
Add,Electrification
Add,Scalable Web Applications
Add,Software Architecture
Add,Software Development
Add,TypeScript
Add,Web Applications
Add,"
