Title,CompanyDetails,JobDetails,JobDescription,JobSkills
"Staff Machine Learning Engineer (Bangkok based, relocation provided)","Agoda · Manila, National Capital Region, Philippines 2 days ago · 1 applicant",Full-time Mid-Senior level,"About the job
About Agoda

Agoda is an online travel booking platform for accommodations, flights, and more. We build and deploy cutting-edge technology that connects travelers with more than 3.6 million accommodations globally. Based in Asia and part of Booking Holdings, our 6,000+ employees representing 90+ nationalities foster a work environment rich in diversity, creativity, and collaboration. We innovate through a culture of experimentation and ownership, enhancing the ability for our customers to experience the world.

Agoda is an online travel booking platform for accommodation, flights, and more. We build and deploy cutting edge technology that connects travelers with more than 2.5 million accommodations globally. Based in Asia and part of Booking Holdings, our 4,000+ talents coming from 90+ different nationalities foster a work environment rich in diversity, creativity, and collaboration. We innovate through a culture of experimentation and ownership, enabling our customers to experience the world.

Get to Know Our Team

The Engineering department oversees all Agoda’s ML and software related requirements. Our goal is to enable and increase Agoda’s business through creative approaches and the implementation of powerful resources such as operational and analytical databases, ML driven solutions, queue systems and data monitoring tools. We hire the brightest minds from around the world to take on this challenge and equip them with the knowledge and tools that contribute to their personal growth and success while supporting our company’s culture of diversity and experimentation. The role the engineering team plays at Agoda is critical as business users, product managers, and many others rely on us to empower their decision making. We are equally dedicated to our customers by improving their search experience with faster results and protecting them from any fraudulent activities. Data is interesting only when you have enough of it, and we have plenty. This is what drives up the challenge as part of the ML engineering squad, but also the reward. We work across structured and non-structured data at scale. For example, our current ML models process millions of images every day to try and enhance the experience that our users get from our app.

Why Agoda Engineering Team (ML role)?

Our engineering teams are at the intersection of business analytics, ml engineering, data warehousing and software engineering. Our job involves dealing with distributed systems, stream processing, ml modeling and computation at tens of PB Scale. We focus on software engineering related to data replication, storage, centralized computation, and Data API’s. By providing our users with ML products/tools, shared frameworks, and ML services, we enable our company to validate strategic decisions, make smarter choices, and react to the fast-changing world. We are a small but passionate team with people from different nationalities working together on a single goal.

In this Role, you will get to:

 Lead the team technically in improving scalability, stability, accuracy, speed and efficiency of our existing ML systems and processes.
 Build, administer and scale ML processing pipelines.
 Be comfortable navigating the following technology stack: Python3, Pyspark, scripting (Bash/Python), Hadoop, SQL, S3 etc.
 Should be able to understand internals of ML models such as Random Forest, CNN, Regression models, etc
 Design, build, test and deploy new libraries, frameworks or full systems for our core systems while keeping to the highest standards of testing and code quality.
 Work with experienced engineers and product owners to identify and build tools to automate many large-scale data management / analysis tasks.
 We believe in end-to-end ownership; this role will involve taking ML models to production at a scale.

What You’ll need to Succeed:

 Bachelor’s degree in computer science /information systems/engineering/related field
 8+ years of experience in software engineering with a minimum of 4+ years in ML
 Good experience in Pyspark
 Expert level understanding of Python with design patterns and object-oriented programming.
 Experience debugging and reasoning about production issues is desirable.
 A good understanding of data architecture principles preferred.
 Any other experience with Big Data technologies / tools
 SQL experience
 Analytical problem-solving capabilities & experience.
 Systems administration skills in Linux
 A strong engineering driven mindset will be required to succeed in this role.

It’s great if you have:

 Good understanding of Hadoop ecosystems
 Experience working with Open-source products
 Experience with Scala development
 Working in an agile environment using test driven methodologies

#telaviv #jerusalem #IT #ENG #4 #sanfrancisco #sanjose #losangeles #sandiego #oakland #denver #miami #orlando #atlanta #chicago #boston #detroit #newyork #portland #philadelphia #dallas #houston #austin #seattle #sydney #melbourne #perth #toronto #vancouver #montreal #shanghai #beijing #shenzhen #prague #Brno #Ostrava #cairo #alexandria #giza #estonia #paris #berlin #munich #hamburg #stuttgart #cologne #frankfurt #hongkong #budapest #jakarta #bali #dublin #telaviv #milan #rome #venice #florence #naples #turin #palermo #bologna #tokyo #osaka #kualalumpur #malta #amsterdam #oslo #manila #warsaw #krakow #doha #alrayyan #riyadh #jeddah #mecca #medina #singapore #seoul #barcelona #madrid #stockholm #zurich #taipei #tainan #taichung #kaohsiung #bangkok #Phuket #istanbul #london #manchester #edinburgh #hcmc #hanoi #lodz #wroclaw #poznan #katowice #rio #salvador #newdelhi #bangalore #bandung #yokohama #nagoya #okinawa #fukuoka #jerusalem #IT #4

Equal Opportunity Employer 

At Agoda, we pride ourselves on being a company represented by people of all different backgrounds and orientations. We prioritize attracting diverse talent and cultivating an inclusive environment that encourages collaboration and innovation. Employment at Agoda is based solely on a person’s merit and qualifications. We are committed to providing equal employment opportunity regardless of sex, age, race, color, national origin, religion, marital status, pregnancy, sexual orientation, gender identity, disability, citizenship, veteran or military status, and other legally protected characteristics.

We will keep your application on file so that we can consider you for future vacancies and you can always ask to have your details removed from the file. For more details please read our privacy policy .

To all recruitment agencies: Agoda does not accept third party resumes. Please do not send resumes to our jobs alias, Agoda employees or any other organization location. Agoda is not responsible for any fees related to unsolicited resumes.","Automation
Add,Big Data
Add,Computer Science
Add,Data Mining
Add,Machine Learning
Add,Problem Solving
Add,PySpark
Add,Python (Programming Language)
Add,Scala
Add,Software Development
Add,"
DevOps Engineer (with E-Commerce experience),"Asia Peopleworks Inc · Muntinlupa City, National Capital Region, Philippines 1 week ago · 12 applicants",Hybrid Full-time Mid-Senior level,"About the job
Design, maintain and evolve architectures and automation for zero-downtime deployments.
Work with Docker and Kubernetes to scale and monitor microservices.
Use tools like Helm and Gitlab CI to automate deployments.
Work with our development teams to help them set up automation pipelines and solve problems.
Collaborate with other DevOps engineers to make the best solution possible.
Build geo-distributed infrastructure
Participate in an on-call schedule and act in a server/technical support capacity to the team.

Qualifications:
  At least 5 years proven experience is a must for this role.
 Proficient in Kubernetes, helmcharts templating, Docker and Docker composer
 Working knowledge of Azure cloud services in IaaS, PaaS, and coming trends in the Cloud space
 Experience in installing enterprise platforms, HCL 9.1 installation and management knowledge is a plus
 Confident configuring CD/CI pipeline based on Agile tools and methodologies (Jira, GitLab, Confluence) in a cloud based (Azure, AWS, GCP) environment
 Proficient with relational database configuration and maintenance (Oracle, Postgres, MySql)
 Familiar with Search Engines (SOLR, Elastic Search)
 Unix SO, shell scripting & make files
 Knowledge of Network configuration cloud environment (Azure AWS, GCP)
 APM tools configuration (New Relic, Dynatrace, …)
 Logging aggregator knowledge like ELK or Splunk
 Performance monitoring across all app stack (DB, WebApp, Cache, CDN). 
 Able to design and implementing performance test
 Akamai CDN basic knowledge (Kona, Image Manager)
 
Office Location: Filinvest Alabang
Office Set-up: Hybrid
Work Shift: Morning/Mid Shift

Interested applicants may send their resume to vin.espinosa@apwtech.com.ph so we can discuss further about the opportunity!","Databases
Add,DevOps
Add,Docker Products
Add,Kubernetes
Add,Microservices
Add,Microsoft Azure
Add,Oracle Database
Add,PostgreSQL
Add,Unix
Add,"
Senior ABAP Developer (Midshift),"Procter & Gamble · Manila, National Capital Region, Philippines Reposted 1 week ago · 7 applicants",Full-time,"About the job
Job Location

Manila

Job Description

The Human Resources Information Services (HRIS) organization provides enterprise-wide people and employee related services to enable the P&G business to win. In this role, you will report to an IT Director. You will lead starting up our HRIS ABAP development team that covers multiple areas including ABAP Object-Oriented programming, customization and enhancement! All this with knowledge on SAP Human Capital Management module that includes Personnel Administration, Organizational Management (OM), Time Management (TM), Payroll and Benefits. In addition to this, experience in employee data migration and integration with other systems is a plus.

The work would include but not limited to problem, change and incident management support, solutions proof of concepts, upgrades, etc. You will lead change management process for catalogs across the HR SAP R3 landscape. Also, provide the right level of governance to ensure standard or in-house security solutions implemented across the landscape are working per design. The candidate must be agile as the work can be fluid at times.

Essential Responsibilities:

Lead requirements gathering, design, development, testing and documenting ABAP solutions for SAP HCM
Design team structure, build and lead the team with leadership skills
Able to write, debug, optimize ABAP code and documentation
Leads team resource planning and development of long-term strategic goals for solution and organization in conjunction with leadership team.
Familiar with ITIL Practices to enable effective transition to ongoing operations
Flexible working on a weekend or holidays to implement a Change Request.
Craft documentation which may include program specification, technical design, code documentation, user manual etc.
Code review and optimization of ABAP programs.
Provide help and guidelines to the key partners in any ABAP solution: customizations, improvements, and enhancements.
Training and knowledge transition to other teammates

Job Qualifications

The candidate will have or be willing to gain knowledge in the following areas:

At least 5+ years of SAP ABAP Development for HCM (PY, PA, OM, TM and Benefits), ABAP Object-Oriented, Integrations and data migrations, SAP transactions/skills related. 
Graduate or Post-graduate degree in Computer Science or equivalent 
has experience handling a team or leading projects is helpful but not required 
Soft skills including ability to lead vendor resources, ability to work in a Global group with limited on-site teammates, strategic team design and development, creative problem solving, customer service capability (including knowing when to elevate issues or provide constructive feedback), and ability to engage in all parts of the support model. Project Management, agile methodologies, SAP HANA, SAP FIORI, OData Services skills are a plus.
Willing to work on a midshift schedule and be on site at least 2 days a week

About Us

We produce globally recognized brands, and we grow the best business leaders in the industry. With a portfolio of trusted brands as diverse as ours, it is paramount our leaders can lead with courage the vast array of brands, categories, and functions. We serve consumers around the world with one of the strongest portfolios of trusted, quality, leadership brands, including Always®, Ariel®, Gillette®, Head & Shoulders®, Herbal Essences®, Oral-B®, Pampers®, Pantene®, Tampax® and more. Our community includes operations in approximately 70 countries worldwide.

Visit http://www.pg.com to know more.

We are an equal opportunity employer and value diversity at our company. We do not discriminate against individuals on the basis of race, color, gender, age, national origin, religion, sexual orientation, gender identity or expression, marital status, citizenship, disability, HIV/AIDS status, or any other legally protected factor.

Job Schedule

Full time

Job Number

R000091650

Job Segmentation

Experienced Professionals (Job Segmentation)","ABAP
Add,Code Review
Add,Computer Science
Add,Documentation
Add,Human Capital Management
Add,On Site
Add,PY
Add,Requirements Gathering
Add,SAP Products
Add,Statutory Accounting Principles (SAP)
Add,"
QA Automation Engineer,"Baker McKenzie · Taguig, National Capital Region, Philippines 1 week ago · 21 applicants",Hybrid Full-time Associate,"About the job
The QA Automation Engineer will manage systems quality to ensure high-quality internally developed solutions and integrations are delivered to the Firm’s product owners and users. The role holder will lead any QA Automation Testing from Functional Test to Load and Performance Testing as well as the training sessions for the team on the various QA Testing Tools.
They also provide feedback and recommendations (resolution and preventive action) to ensure that systems introductions, enhancements, and new product customizations meet the business needs.

Major tasks are designing, creating, enhancing, and executing automated test scripts and providing detailed reports to the project teams. This position has a responsibility for coordinating the Automation testing with the QA Team and other project teams involved to complete this kind of activity.

Responsibilities:
Leads the Testing Automation projects
Must be able to design, develop, execute, and manage automated scripts in HP Tools: HP UFT, ALM, Performance Center, and Microsoft Visual Studio Test Professional
Implement QA Automation process and best practices
Prepares Test Automation Plan by understanding application requirements and coordinating with the Test Leads, Project Managers, Development Leads, and other Project Team resources
Design, create and execute manual test scripts when needed
Design and implement automated test scenarios
Monitor test results up to closure and communicates to the project teams
Provides feedback and recommendations (resolution and preventive actions) to the development team on defects detected in the testing
Lead, mentor, and help up-skill other members of the team when it comes to Automated Testing
Provides post-deployment testing, coordination, and support
Provides recommendations for improving QA Standards and Processes, particularly in Automation Testing

Responsibility for Results:
Lead the automation testing activity for projects
Execution of Test Scripts according to agreed-upon schedules Complete Test results
Functional knowledge of the applications assigned
Flexible to changing needs, easily adaptable to new situations and directions
Open for work on the weekend for deployment testing

Skills and Experience:
Strong understanding of Software Testing Best Practices, Tools and Methodologies like Agile Methodology and experience creating test scripts based on requirements
Expertise in VB Scripting
Proven experience developing automated test systems and scripts beyond record and playback. Specifically developing functions, adding control flow logic, loops, etc.
Strong experience in at least two languages: C#, VB.NET, ASP.NET, C++, Java
Experience in testing Mobile Applications
Working knowledge of SQL and general scripting
Strong understanding of Cross-Browser compatibility issues and Operating System issues
Working knowledge of SQL and general scripting
Strong knowledge and experience in Testing Tools and Methodology (HP QTP/UFT, ALM, Performance Center, Visual Studio Test Professional preferred)
Experience in VS2012/VS2015
Open for work on the weekend for Post Deployment testing
Strong Analytical and Problem-Solving Skills
Strong verbal and written communication skills, attention to detail, and can work independently
Must have good collaboration skills
Can work well with the team","ASP.NET
Add,C#
Add,Functional Testing
Add,HP QuickTest Professional (QTP)
Add,Java
Add,Problem Solving
Add,QA Automation
Add,SQL
Add,Test Automation
Add,Visual Studio
Add,"
Cloud Platform Engineer,"Macquarie Group · Manila, National Capital Region, Philippines 2 weeks ago · 21 applicants",Hybrid Full-time,"About the job
Manila

Help us build the leading industry digital platform with the latest cloud technologies. As a talented Cloud Platform Engineer, you will showcase your deep understanding of Kubernetes and Cloud infrastructure within our team.

At Macquarie, we are working to create lasting value for our communities, our clients and our people. We are a global financial services group operating in 34 markets and with 54 years of unbroken profitability. You’ll be part of a supportive team where everyone - no matter what role - contributes ideas and drive outcomes.

What role will you play?

In the Engineering Enablers team, you will be part of a full lifecycle greenfield team supporting automation tooling and industry leading distributed systems and Kubernetes platforms. We are striving for 100% on cloud, with a massive focus on Google Cloud. You will support our development teams onboard and run their applications on our Google Cloud and Kubernetes platforms.

What You Offer

2-5 years experience running and maintaining cloud solutions that interact with Kubernetes
2-5 years experience running and maintaining Google Cloud environments, though AWS and Azure experience is also desirable
Experience supporting development teams, triaging requests and incidents
Experience with utilising Infrastructure as Code tools
Experience in managing declarative GitOps pipelines based on ArgoCD
Experience with monitoring platforms with Prometheus & Grafana
Real world experience in supporting production applications
Google Cloud experience is desirable.

We love hearing from anyone inspired to build a better future with us, if you're excited about the role or working at Macquarie we encourage you to apply.

Benefits

Macquarie employees can access a wide range of benefits which, depending on eligibility criteria and location, include:

Hybrid and flexible working arrangements
One wellbeing leave day per year
Paid parental leave as well as benefits to support you as you transition to life as a working parent
Paid volunteer leave and donation matching
Other benefits to support your physical, mental and financial wellbeing
Access a wide range of learning and development opportunities
Employee Assistance Program, a robust behavioural health network with counselling and coaching services
Recognition and service awards 

About The Corporate Operations Group

In our Corporate Operations Group, you will work at the heart of Macquarie. Join a collaborative team who accelerate digitalisation, sustainability and social impact for the benefit of our people, customers, shareholders and communities. Our teams include technology, digital transformation and data, operations, human resources, business services, corporate strategy and solutions and the Macquarie Group Foundation.

 Our commitment to Diversity, Equity and Inclusion 

We are committed to providing a working environment that embraces diversity, equity, and inclusion. We encourage people from all backgrounds to apply for a role regardless of their identity, including gender, race, ethnicity, cultural identity, nationality, age, sexual orientation, gender identity, intersex status, marital or family status, neurodiversity, religion or belief, disabilities, or socio-economic background.

If you require adjustments to your working arrangements or the recruitment process, please let us know when applying.

About Macquarie

A career at Macquarie means you’ll have the opportunity to develop new skills, explore interesting fields and do challenging work that will impact the lives of people around the world—whether it’s accelerating the green energy transition, helping sustain global food supplies, financing social housing projects or investing in essential infrastructure. At Macquarie, we’re empowering people to innovate and invest for a better future.

Macquarie is a global financial group providing clients with asset management, retail and business banking, wealth management, leasing and asset financing, market access, commodity trading, renewables development, specialist advisory, capital raising and principal investment.

Find out more at www.macquarie.com/careers

Job no: COG-975220

Work type: Permanent - Full time

Location: Manila

Category: Mid-level, Technology

Group: Corporate Operations Group

Division: Technology

Recruiter: Gee Quimbo

Opening Date: 08/12/2023",
IT Infrastructure Engineer,"CloudPay · Makati, National Capital Region, Philippines Reposted 1 week ago · 66 applicants",Hybrid Full-time Entry level,"About the job
Role Pitch  If you’re a self-starter, that likes a challenge and looking for an exciting new Cloud Infrastructure Engineer role where you will have a real influence and impact on Cloud Infrastructure design, this is the role for you. This is a fantastic opportunity to join a highly skilled, high-functioning team, forming an essential part of a rapidly expanding global business within the technology and financial services space.

CloudPay is towards the end of migrating its data centre hosted services to AWS and is in the early stages of formulating its public cloud tech strategy to keep scaling and make best use of the technology now at its disposal. With a company growing at 30% for 5 years straight, we find ourselves at an inflexion point in our technology stacks and IT organizational structure. CloudPay’s engineering teams build very sophisticated software using open-source technologies with the majority being in Java. We now operate in AWS and are closing out our DC usage. Our systems engineers play a crucial role in the design, building and maintenance of all our software and services.

CloudPay builds, deploys and operates half a dozen customer facing services and many more backend services across 1000+ Linux hosts and AWS-managed services. The ideal candidate will have a good working knowledge of Linux Systems is strong with scripting in various languages, working with AWS and is a strong study of new technology.

 Key Responsibilities  Daily Duties and Main Responsibilities will include:

 Provision and maintain secure cloud infrastructure
 Partner with scrum teams to deliver software releases
 Build and manage secure automated systems
 Maintain complete and comprehensive documentation
 Manage logging, monitoring and alerting systems
 Support incidents as they occur and work with teams on preventing future incidents
 Work closely with engineers across all teams in different parts of the world

 Description  Attributes and Experience Required:

 3+ years in a similar role
 Good documentation and communications skills
 Relevant degree or equivalent experience
 Experience working with agile teams
 Keen sense of ownership and drive, delivering on what you and your team have agreed on
 A good understanding of the following concepts and standard practices:
 GitOps and ITIL
 IT security; GDPR, encryption at-rest/in-transit, patching, least-privilege
 Networking; VPNs, Transit Gateways, routing, DNS, firewalls
 GitOps and ITIL
 Experience working with complex and, sometimes, tightly coupled systems
 Strong experience with the following technology:
 BASH
 Puppet and Foreman
 Rundeck
 Terraform and AWS
 Containerisation and microservice architecture
 Desirable Experience:
 JIRA, Confluence, Bitbucket
 Bamboo, Jenkins
 Apache, Nginx, Tomcat
 MySQL, MongoDB
 Ruby, PHP, Python
 Bamboo, Jenkins
 AWS: AWS Organisations, VPC, Transit Gateway, Gateway Load Balancer, VPN, Application/Network Load Balancer, ACM, EC2, ECS, EKS, Lambda, IAM, Security Groups, CloudTrail, CloudWatch, RDS, Amazon MQ

 Benefits  Package and Benefits:

 Competitive annual salary and benefits package
 18 days annual leave plus public holidays
 Earned Wage Access (via CloudPay Now app)
 Flexible remote working
 10 days sick leave
 HMO
 Personal and professional development opportunities
 Friendly working environment","Communication
Add,Digital Authentication
Add,Domain Name System (DNS)
Add,General Data Protection Regulation (GDPR)
Add,GitOps
Add,Microservices
Add,Networking
Add,Puppet (Software)
Add,Technical Support
Add,Troubleshooting
Add,"
