Title,CompanyDetails,JobDetails,JobDescription,JobSkills
Machine Learning Specialist (Python),"OpenText · Makati, National Capital Region, Philippines 2 weeks ago · 37 applicants",On-site Full-time Mid-Senior level,"About the job
The opportunity:

We are looking for an experienced Python Developer to join our Innovations Team and help us create dynamic software applications. In this role, you will be responsible for writing and testing scalable code, developing back-end components, and integrating user-facing elements.

You are great at:
Coordinating with development teams to determine application requirements.
Writing scalable code using Python programming language.
Testing and debugging applications.
Developing back-end components.
Integrating user-facing elements using server-side logic.
Assessing and prioritizing client feature requests.
Integrating data storage solutions.
Coordinating with front-end developers.
Reprogramming existing databases to improve functionality.
Developing digital tools to monitor online traffic.

What it takes:
Bachelor's degree in computer science, computer engineering, or related field.
5-8 years of experience as a Python developer.
Expert knowledge of Python and related frameworks.
A deep understanding and multi-process architecture and the threading limitations of Python.
Familiarity with server-side templating languages.
Ability to integrate multiple data sources into a single system.
Familiarity with testing tools.
Ability to collaborate on projects and work independently when required.
Open to work on either APJ or EMEA or Americas business hours.

Hybrid Work Model: 3 days onsite, then 2 days remote work per week.","Data Analysis,Analytics
Add,Artificial Intelligence (AI)
Add,Automation
Add,Data Science
Add,Internet of Things (IoT)
Add,Machine Learning
Add,Python (Programming Language)
Add,Software Development
Add,Software Development Life Cycle (SDLC)
Add,"
